id,code,name,city,country,latitude,longitude1107,YCL, Charlo, Charlo, Canada,47.991,-66.3301108,YCN, Cochrane, Cochrane, Canada,49.107,-81.0151109,YCO, Kugluktuk, Coppermine, Canada,67.817,-115.1441110,YCR, Cross Lake - Charlie Sinclair Memorial Airport, Cross Lake, Canada,54.611,-97.7601111,YCS, Chesterfield Inlet Airport, Chesterfield Inlet, Canada,63.347,-90.7311112,YCT, Coronation, Coronation, Canada,52.075,-111.4451113,YCW, Chilliwack, Chilliwack, Canada,49.153,-121.9391114,YCY, Clyde River, Clyde River, Canada,70.486,-68.5171115,YZS, Fairmont Hot Springs, Coral Harbour, Canada,64.193,-83.3591116,YDA, Dawson City, Dawson, Canada,64.043,-139.1281117,YDB, Burwash, Burwash, Canada,61.371,-139.0411118,YDC, Princeton, Princeton, Canada,49.468,-120.5111119,YDF, Deer Lake, Deer Lake, Canada,49.211,-57.3911120,YDL, Dease Lake, Dease Lake, Canada,58.422,-130.0321121,YDN, Dauphin Barker, Dauphin, Canada,51.101,-100.0531122,YDP, Nain Airport, Nain, Canada,56.549,-61.6801123,YDQ, Dawson Creek, Dawson Creek, Canada,55.742,-120.1831124,YEG, Edmonton Intl, Edmonton, Canada,53.310,-113.5801125,YEK, Arviat, Eskimo Point, Canada,61.094,-94.0711126,YEM, Manitoulin East, Manitowaning, Canada,45.843,-81.8581127,YEN, Estevan, Estevan, Canada,49.210,-102.9661128,YER, Fort Severn Airport, Fort Severn, Canada,56.019,-87.6761129,YET, Edson, Edson, Canada,53.579,-116.4651130,YEU, Eureka, Eureka, Canada,79.995,-85.8141131,YEV, Inuvik Mike Zubko, Inuvik, Canada,68.304,-133.4831132,YFA, Fort Albany Airport, Fort Albany, Canada,52.201,-81.6971133,YFB, Iqaluit, Iqaluit, Canada,63.756,-68.5561134,YFC, Fredericton, Fredericton, Canada,45.869,-66.5371135,YFD, Brantford, Brantford, Canada,43.131,-80.3431136,YFH, Fort Hope Airport, Fort Hope, Canada,51.562,-87.9081137,YTM, Riviere Rouge - Mont-Tremblant International Inc. Airport, Mont-Tremblant, Canada,46.409,-74.7801138,YFO, Flin Flon, Flin Flon, Canada,54.678,-101.6821139,YFR, Fort Resolution, Fort Resolution, Canada,61.181,-113.6901140,YFS, Fort Simpson, Fort Simpson, Canada,61.760,-121.2371141,YMN, Makkovik Airport, Makkovik, Canada,55.077,-59.1861142,YGB, Texada Gillies Bay Airport, Texada, Canada,49.694,-124.5181143,YGE, Golden Airport, Golden, Canada,51.299,-116.9821144,YGH, Fort Good Hope, Fort Good Hope, Canada,66.267,-128.6501145,YGK, Kingston, Kingston, Canada,44.225,-76.5971146,YGL, La Grande Riviere, La Grande Riviere, Canada,53.625,-77.7041147,YGM, Gimli Industrial Park Airport, Gimli, Canada,50.628,-97.0431148,YGO, Gods Lake Narrows Airport, Gods Lake Narrows, Canada,54.559,-94.4911149,YGP, Gaspe, Gaspe, Canada,48.775,-64.4791150,YGQ, Geraldton Greenstone Regional, Geraldton, Canada,49.778,-86.9391151,YGR, Iles De La Madeleine, Iles De La Madeleine, Canada,47.425,-61.7781152,YGT, Igloolik Airport, Igloolik, Canada,69.365,-81.8161153,YGV, Havre Saint-Pierre Airport, Havre-Saint-Pierre, Canada,50.282,-63.6111154,YGW, Kuujjuarapik Airport, Kuujjuarapik, Canada,55.282,-77.7651155,YGX, Gillam Airport, Gillam, Canada,56.358,-94.7111156,YGZ, Grise Fiord Airport, Grise Fiord, Canada,76.426,-82.9091157,YQC, Quaqtaq Airport, Quaqtaq, Canada,61.046,-69.6181158,YHB, Hudson Bay, Hudson Bay, Canada,52.817,-102.3111159,YHC, Vancouver Harbour Water Airport, Vancouver, Canada,49.294,-123.1111160,YHD, Dryden Rgnl, Dryden, Canada,49.832,-92.7441161,YHF, Rene Fontaine, Hearst, Canada,49.714,-83.6871162,YNS, Nemiscau Airport, Nemiscau, Canada,51.691,-76.1361163,YHI, Ulukhaktok Holman, Holman Island, Canada,70.763,-117.8061164,YHK, Gjoa Haven, Gjoa Haven, Canada,68.636,-95.8501165,YHM, Hamilton, Hamilton, Canada,43.174,-79.9351166,YHN, Hornepayne, Hornepayne, Canada,49.193,-84.7591167,YHO, Hopedale Airport, Hopedale, Canada,55.448,-60.2291168,YHR, Chevery Airport, Chevery, Canada,50.469,-59.6371169,YHU, St Hubert, Montreal, Canada,45.518,-73.4171170,YHY, Hay River, Hay River, Canada,60.840,-115.7831171,YHZ, Halifax Intl, Halifax, Canada,44.881,-63.5091172,YIB, Atikokan Muni, Atikokan, Canada,48.774,-91.6391173,YIF, St Augustin Airport, St-Augustin, Canada,51.212,-58.6581174,YIK, Ivujivik Airport, Ivujivik, Canada,62.417,-77.9251175,YIO, Pond Inlet, Pond Inlet, Canada,72.683,-77.9671176,YIV, Island Lake Airport, Island Lake, Canada,53.857,-94.6541177,YJM, Fort St. James - Perison Airport, Fort St. James, Canada,54.397,-124.2631178,YJN, St Jean, St. Jean, Canada,45.294,-73.2811179,ZEL, Bella Bella Airport, Bella Bella, Canada,52.140,-128.0641180,YJT, Stephenville, Stephenville, Canada,48.544,-58.5501181,YKA, Kamloops, Kamloops, Canada,50.702,-120.4441182,LAK, Aklavik, Aklavik, Canada,68.223,-135.0061183,YKF, Waterloo, Waterloo, Canada,43.461,-80.3791184,YWB, Kangiqsujuaq - Wakeham Bay Airport, Kangiqsujuaq, Canada,61.589,-71.9291185,YKL, Schefferville, Schefferville, Canada,54.805,-66.8051186,AKV, Akulivik Airport, Akulivik, Canada,60.819,-78.1491187,YKQ, Waskaganish Airport, Waskaganish, Canada,51.473,-78.7581188,YKX, Kirkland Lake, Kirkland Lake, Canada,48.210,-79.9811189,YKY, Kindersley, Kindersley, Canada,51.518,-109.1811190,YKZ, Buttonville Muni, Toronto, Canada,43.862,-79.3701191,YPJ, Aupaluk Airport, Aupaluk, Canada,59.297,-69.6001192,YLC, Kimmirut Airport, Kimmirut, Canada,62.850,-69.8831193,YLD, Chapleau, Chapleau, Canada,47.820,-83.3471194,YLH, Lansdowne House Airport, Lansdowne House, Canada,52.196,-87.9341195,YLJ, Meadow Lake, Meadow Lake, Canada,54.125,-108.5231196,YSG, Lutselk'e Airport, Lutselk'e, Canada,62.418,-110.6821197,YLL, Lloydminster, Lloydminster, Canada,53.309,-110.0731198,YLT, Alert, Alert, Canada,82.518,-62.2811199,XGR, Kangiqsualujjuaq (Georges River) Airport, Kangiqsualujjuaq, Canada,58.711,-65.9931200,YLW, Kelowna, Kelowna, Canada,49.956,-119.3781201,YMA, Mayo, Mayo, Canada,63.616,-135.8681202,YMG, Manitouwadge, Manitouwadge, Canada,49.084,-85.8611203,YMH, Mary's Harbour Airport, Mary's Harbour, Canada,52.303,-55.8471204,YMJ, Moose Jaw Air Vice Marshal C M Mcewen, Moose Jaw, Canada,50.330,-105.5591205,YMM, Fort Mcmurray, Fort Mcmurray, Canada,56.653,-111.2221206,YMO, Moosonee, Moosonee, Canada,51.291,-80.6081207,YMT, Chapais Airport, Chibougamau, Canada,49.772,-74.5281208,YUD, Umiujaq Airport, Umiujaq, Canada,56.536,-76.5181209,YMW, Maniwaki, Maniwaki, Canada,46.273,-75.9911210,YMX, Montreal Intl Mirabel, Montreal, Canada,45.682,-74.0051211,YNA, Natashquan, Natashquan, Canada,50.190,-61.7891212,YNC, Wemindji Airport, Wemindji, Canada,53.011,-78.8311213,YND, Gatineau, Gatineau, Canada,45.522,-75.5641214,YNE, Norway House Airport, Norway House, Canada,53.958,-97.8441215,YNL, Points North Landing Airport, Points North Landing, Canada,58.277,-104.0821216,YNM, Matagami, Matagami, Canada,49.762,-77.8031217,YOA, Ekati, Ekati, Canada,64.699,-110.6151218,YOC, Old Crow, Old Crow, Canada,67.571,-139.8391219,YOD, Cold Lake, Cold Lake, Canada,54.405,-110.2791220,YOH, Oxford House Airport, Oxford House, Canada,54.933,-95.2791221,YOJ, High Level, High Level, Canada,58.621,-117.1651222,YOO, Oshawa Airport, Oshawa, Canada,43.923,-78.8951223,YOP, Rainbow Lake Airport, Rainbow Lake, Canada,58.491,-119.4081224,YOW, Ottawa Macdonald Cartier Intl, Ottawa, Canada,45.323,-75.6691225,YPA, Prince Albert Glass Field, Prince Albert, Canada,53.214,-105.6731226,YPC, Paulatuk, Paulatuk, Canada,62.350,-124.3331227,YPE, Peace River, Peace River, Canada,56.227,-117.4471228,YPG, Southport, Portage-la-prairie, Canada,49.903,-98.2741229,YPH, Inukjuak Airport, Inukjuak, Canada,58.472,-78.0771230,YPI, Seaplane Base, Port Simpson, Canada,54.567,-130.4331231,YPL, Pickle Lake, Pickle Lake, Canada,51.446,-90.2141232,YPM, Pikangikum Airport, Pikangikum, Canada,51.820,-93.9731233,YPN, Port Menier, Port Menier, Canada,49.836,-64.2891234,YPO, Peawanuck Airport, Peawanuck, Canada,54.988,-85.4431235,YPQ, Peterborough, Peterborough, Canada,44.230,-78.3631236,YPR, Prince Rupert, Prince Pupert, Canada,54.286,-130.4451237,YPW, Powell River Airport, Powell River, Canada,49.834,-124.5001238,YPX, Puvirnituq Airport, Puvirnituq, Canada,60.051,-77.2871239,YPY, Fort Chipewyan, Fort Chipewyan, Canada,58.767,-111.1171240,YQA, Muskoka, Muskoka, Canada,44.975,-79.3031241,YQB, Quebec Jean Lesage Intl, Quebec, Canada,46.791,-71.3931242,YQD, The Pas Airport, The Pas, Canada,53.971,-101.0911243,YQF, Red Deer Regional, Red Deer Industrial, Canada,52.182,-113.8941244,YQG, Windsor, Windsor, Canada,42.276,-82.9561245,YQH, Watson Lake, Watson Lake, Canada,60.116,-128.8231246,YQI, Yarmouth Airport, Yarmouth, Canada,43.827,-66.0881247,YQK, Kenora, Kenora, Canada,49.788,-94.3631248,YQL, Lethbridge, Lethbridge, Canada,49.630,-112.8001249,YQM, Greater Moncton Intl, Moncton, Canada,46.112,-64.6791250,YQN, Nakina Airport, Nakina, Canada,50.183,-86.6961251,YQQ, Comox, Comox, Canada,49.711,-124.8871252,YQR, Regina Intl, Regina, Canada,50.432,-104.6661253,YQT, Thunder Bay, Thunder Bay, Canada,48.372,-89.3241254,YQU, Grande Prairie, Grande Prairie, Canada,55.180,-118.8851255,YQV, Yorkton Muni, Yorkton, Canada,51.265,-102.4621256,YQW, North Battleford, North Battleford, Canada,52.769,-108.2441257,YQX, Gander Intl, Gander, Canada,48.937,-54.5681258,YQY, Sydney, Sydney, Canada,46.161,-60.0481259,YQZ, Quesnel, Quesnel, Canada,53.026,-122.5101260,YRA, Rae Lakes Airport, Gamt, Canada,64.116,-117.3101261,YRB, Resolute Bay, Resolute, Canada,74.717,-94.9691262,YRI, Riviere Du Loup, Riviere Du Loup, Canada,47.764,-69.5851263,YRJ, Roberval, Roberval, Canada,48.520,-72.2661264,YRL, Red Lake Airport, Red Lake, Canada,51.067,-93.7931265,YRM, Rocky Mountain House, Rocky Mountain House, Canada,52.430,-114.9041266,YRQ, Trois Rivieres Airport, Trois Rivieres, Canada,46.352,-72.6811267,YRS, Red Sucker Lake Airport, Red Sucker Lake, Canada,54.167,-93.5571268,YRT, Rankin Inlet, Rankin Inlet, Canada,62.811,-92.1161269,YRV, Revelstoke Airport, Revelstoke, Canada,50.967,-118.1831270,YSB, Sudbury, Sudbury, Canada,46.625,-80.7991271,YSC, Sherbrooke, Sherbrooke, Canada,45.439,-71.6911272,YSF, Stony Rapids Airport, Stony Rapids, Canada,59.250,-105.8411273,YSJ, Saint John, St. John, Canada,45.316,-65.8901274,YSK, Sanikiluaq Airport, Sanikiluaq, Canada,56.538,-79.2471275,YSM, Fort Smith, Fort Smith, Canada,60.020,-111.9621276,YSP, Marathon, Marathon, Canada,48.755,-86.3441277,YSR, Nanisivik, Nanisivik, Canada,72.982,-84.6141278,YST, St. Theresa Point Airport, St. Theresa Point, Canada,53.846,-94.8521279,YSU, Summerside, Summerside, Canada,46.441,-63.8341280,YSY, Sachs Harbour, Sachs Harbour, Canada,71.994,-125.2431281,YTA, Pembroke Airport, Pembroke, Canada,45.864,-77.2521282,YTE, Cape Dorset, Cape Dorset, Canada,64.230,-76.5271283,YTF, Alma Airport, Alma, Canada,48.509,-71.6411284,YTH, Thompson, Thompson, Canada,55.801,-97.8641285,YTL, Big Trout Lake Airport, Big Trout Lake, Canada,53.818,-89.8971286,YTQ, Tasiujaq Airport, Tasiujaq, Canada,58.668,-69.9561287,YTR, Trenton, Trenton, Canada,44.119,-77.5281288,YTS, Timmins, Timmins, Canada,48.570,-81.3771289,YTZ, City Centre, Toronto, Canada,43.627,-79.3961290,YUB, Tuktoyaktuk, Tuktoyaktuk, Canada,69.433,-133.0261291,YUL, Pierre Elliott Trudeau Intl, Montreal, Canada,45.471,-73.7411292,YUT, Repulse Bay, Repulse Bay, Canada,66.521,-86.2251293,YUX, Hall Beach, Hall Beach, Canada,68.776,-81.2441294,YUY, Rouyn Noranda, Rouyn, Canada,48.206,-78.8361295,YVB, Bonaventure Airport, Bonaventure, Canada,48.071,-65.4601296,YVC, La Ronge, La Ronge, Canada,55.151,-105.2621297,YVG, Vermilion, Vermillion, Canada,53.356,-110.8241298,YVM, Qikiqtarjuaq, Broughton Island, Canada,67.546,-64.0311299,YVO, Val D Or, Val D'or, Canada,48.053,-77.7831300,YVP, Kuujjuaq, Quujjuaq, Canada,58.096,-68.4271301,YVQ, Norman Wells, Norman Wells, Canada,65.282,-126.7981302,YVR, Vancouver Intl, Vancouver, Canada,49.194,-123.1841303,YVT, Buffalo Narrows, Buffalo Narrows, Canada,55.842,-108.4181304,YVV, Wiarton, Wiarton, Canada,44.746,-81.1071305,YVZ, Deer Lake Airport, Deer Lake, Canada,52.656,-94.0611306,YWA, Petawawa, Petawawa, Canada,45.952,-77.3191307,YWG, Winnipeg Intl, Winnipeg, Canada,49.910,-97.2401308,YWH, Victoria Inner Harbour Airport, Victoria, Canada,48.423,-123.3881309,YWJ, Deline, Deline, Canada,65.183,-125.4171310,YWK, Wabush, Wabush, Canada,52.922,-66.8641311,YWL, Williams Lake, Williams Lake, Canada,52.183,-122.0541312,YWP, Webequie Airport, Webequie, Canada,52.960,-87.3691313,YWY, Wrigley, Wrigley, Canada,63.209,-123.4371314,YXC, Canadian Rockies Intl, Cranbrook, Canada,49.612,-115.7821315,YXD, Edmonton City Centre, Edmonton, Canada,53.573,-113.5211316,YXE, Saskatoon J G Diefenbaker Intl, Saskatoon, Canada,52.171,-106.7001317,YXH, Medicine Hat, Medicine Hat, Canada,50.019,-110.7211318,YXJ, Fort St John, Fort Saint John, Canada,56.238,-120.7401319,YXK, Rimouski Airport, Rimouski, Canada,48.478,-68.4971320,YXL, Sioux Lookout, Sioux Lookout, Canada,50.114,-91.9051321,YXN, Whale Cove Airport, Whale Cove, Canada,62.240,-92.5981322,YXP, Pangnirtung, Pangnirtung, Canada,66.145,-65.7141323,YXR, Timiskaming Rgnl, Earlton, Canada,47.695,-79.8491324,YXS, Prince George, Prince George, Canada,53.889,-122.6791325,YXT, Terrace, Terrace, Canada,54.469,-128.5761326,YXU, London, London, Canada,43.033,-81.1511327,YXX, Abbotsford, Abbotsford, Canada,49.025,-122.3611328,YXY, Whitehorse Intl, Whitehorse, Canada,60.710,-135.0671329,YXZ, Wawa, Wawa, Canada,47.967,-84.7861330,YYB, North Bay, North Bay, Canada,46.364,-79.4231331,YYC, Calgary Intl, Calgary, Canada,51.114,-114.0201332,YYD, Smithers, Smithers, Canada,54.825,-127.1831333,YYE, Fort Nelson, Fort Nelson, Canada,58.836,-122.5971334,YYF, Penticton, Penticton, Canada,49.463,-119.6021335,YYG, Charlottetown, Charlottetown, Canada,46.290,-63.1211336,YYH, Taloyoak, Spence Bay, Canada,69.547,-93.5771337,YYJ, Victoria Intl, Victoria, Canada,48.647,-123.4261338,YYL, Lynn Lake, Lynn Lake, Canada,56.864,-101.0761339,YYN, Swift Current, Swift Current, Canada,50.292,-107.6911340,YYQ, Churchill, Churchill, Canada,58.739,-94.0651341,YYR, Goose Bay, Goose Bay, Canada,53.319,-60.4261342,YYT, St Johns Intl, St. John's, Canada,47.619,-52.7521343,YYU, Kapuskasing, Kapuskasing, Canada,49.414,-82.4681344,YYW, Armstrong, Armstrong, Canada,50.290,-88.9101345,YYY, Mont Joli, Mont Joli, Canada,48.609,-68.2081346,YYZ, Lester B Pearson Intl, Toronto, Canada,43.677,-79.6311347,YZD, Downsview, Toronto, Canada,43.743,-79.4661348,YZE, Gore Bay Manitoulin, Gore Bay, Canada,45.885,-82.5681349,YZF, Yellowknife, Yellowknife, Canada,62.463,-114.4401350,YZG, Salluit Airport, Salluit, Canada,62.179,-75.6671351,YZH, Slave Lake, Slave Lake, Canada,55.293,-114.7771352,YZP, Sandspit, Sandspit, Canada,53.254,-131.8141353,YZR, Chris Hadfield, Sarnia, Canada,42.999,-82.3091354,YZT, Port Hardy, Port Hardy, Canada,50.681,-127.3671355,YZU, Whitecourt, Whitecourt, Canada,54.144,-115.7871356,YZV, Sept Iles, Sept-iles, Canada,50.223,-66.2661357,YZW, Teslin, Teslin, Canada,60.173,-132.7431358,YZX, Greenwood, Greenwood, Canada,44.984,-64.9171359,YZY, Mackenzie Airport, Mackenzie British Columbia, Canada,55.299,-123.0831360,ZAC, York Landing Airport, York Landing, Canada,56.089,-96.0891361,YDT, Boundary Bay Airport, Boundary Bay, Canada,49.074,-123.0081362,ILF, Ilford Airport, Ilford, Canada,56.061,-95.6141363,ZBF, Bathurst Airport, Bathurst, Canada,47.630,-65.7391364,ZBM, Bromont Airport, Bromont, Canada,45.291,-72.7421365,ZEM, Eastmain River Airport, Eastmain River, Canada,52.226,-78.5231366,ZFA, Faro, Faro, Canada,62.208,-133.3761367,ZFD, Fond-Du-Lac Airport, Fond-Du-Lac, Canada,59.334,-107.1821368,ZFM, Fort Mcpherson, Fort Mcpherson, Canada,67.408,-134.8611369,ZFN, Tulita, Tulita, Canada,64.083,-125.5831370,ZGI, Gods River Airport, Gods River, Canada,54.840,-94.0791371,ZGR, Little Grand Rapids Airport, Little Grand Rapids, Canada,52.045,-95.4661372,ZJN, Swan River Airport, Swan River, Canada,52.121,-101.2361373,ZKE, Kashechewan Airport, Kashechewan, Canada,52.283,-81.6781374,MSA, Muskrat Dam Airport, Muskrat Dam, Canada,53.441,-91.7631375,ZML, South Cariboo Regional Airport, 108 Mile Ranch, Canada,51.441,-121.1961376,ZMT, Masset Airport, Masset, Canada,54.028,-132.1251377,ZPB, Sachigo Lake Airport, Sachigo Lake, Canada,53.891,-92.1961378,ZRJ, Round Lake (Weagamow Lake) Airport, Round Lake, Canada,52.944,-91.3131379,ZSJ, Sandy Lake Airport, Sandy Lake, Canada,53.064,-93.3441380,XSI, South Indian Lake Airport, South Indian Lake, Canada,56.793,-98.9071381,ZSW, Seal Cove Seaplane Base, Prince Rupert, Canada,54.333,-130.2831382,ZTM, Shamattawa Airport, Shamattawa, Canada,55.866,-92.0811383,ZUM, Churchill Falls Airport, Churchill Falls, Canada,53.562,-64.1061384,XLB, Lac Brochet Airport, Lac Brochet, Canada,58.614,-101.4691385,ZWL, Wollaston Lake Airport, Wollaston Lake, Canada,58.107,-103.1721386,BJA, Soummam, Bejaja, Algeria,36.712,5.0701387,ALG, Houari Boumediene, Algier, Algeria,36.691,3.2151388,DJG, Tiska, Djanet, Algeria,24.293,9.4521389,QFD, Boufarik, Boufarik, Algeria,36.546,2.8761390,VVZ, Illizi Takhamalt, Illizi, Algeria,26.724,8.6231391,QSF, Ain Arnat Airport, Setif, Algeria,36.178,5.3241392,TMR, Tamanrasset, Tamanrasset, Algeria,22.811,5.4511393,GJL, Jijel, Jijel, Algeria,36.795,5.8741394,AAE, Annaba, Annaba, Algeria,36.822,7.8091395,CZL, Mohamed Boudiaf Intl, Constantine, Algeria,36.276,6.6201396,TEE, Cheikh Larbi Tebessi, Tebessa, Algeria,35.432,8.1211397,BLJ, Batna Airport, Batna, Algeria,35.752,6.3091398,HRM, Hassi R Mel, Tilrempt, Algeria,32.930,3.3121399,QDJ, Tsletsi Airport, Djelfa, Algeria,34.666,3.3511400,TID, Bou Chekif, Tiaret, Algeria,35.341,1.4631401,TIN, Tindouf, Tindouf, Algeria,27.700,-8.1671402,QAS, Ech Cheliff, Ech-cheliff, Algeria,36.213,1.3321403,TAF, Tafaraoui, Oran, Algeria,35.542,-0.5321404,TLM, Zenata, Tlemcen, Algeria,35.017,-1.4501405,ORN, Es Senia, Oran, Algeria,35.624,-0.6211406,CBH, Bchar Boudghene Ben Ali Lotfi Airport, Bchar, Algeria,31.646,-2.2701407,MUW, Ghriss, Ghriss, Algeria,35.208,0.1471408,BMW, Bordj Badji Mokhtar Airport, Bordj Badji Mokhtar, Algeria,21.375,0.9241409,AZR, Touat Cheikh Sidi Mohamed Belkebir, Adrar, Algeria,27.838,-0.1861410,BSK, Biskra, Biskra, Algeria,34.793,5.7381411,ELG, El Golea, El Golea, Algeria,30.571,2.8601412,GHA, Noumerat, Ghardaia, Algeria,32.384,3.7941413,HME, Oued Irara, Hassi Messaoud, Algeria,31.673,6.1401414,INZ, In Salah, In Salah, Algeria,27.251,2.5121415,TGR, Sidi Mahdi, Touggourt, Algeria,33.068,6.0891416,LOO, Laghouat, Laghouat, Algeria,33.764,2.9281417,ELU, Guemar Airport, Guemar, Algeria,33.511,6.7771418,TMX, Timimoun, Timimoun, Algeria,29.237,0.2761419,OGX, Ouargla, Ouargla, Algeria,31.917,5.4131420,IAM, In Amenas, Zarzaitine, Algeria,28.052,9.6431421,COO, Cadjehoun, Cotonou, Benin,6.357,2.3841422,OUA, Ouagadougou, Ouagadougou, Burkina Faso,12.353,-1.5121423,BOY, Bobo Dioulasso, Bobo-dioulasso, Burkina Faso,11.160,-4.3311424,ACC, Kotoka Intl, Accra, Ghana,5.605,-0.1671425,TML, Tamale, Tamale, Ghana,9.557,-0.8631426,KMS, Kumasi Airport, Kumasi, Ghana,6.715,-1.5911427,NYI, Sunyani, Sunyani, Ghana,7.362,-2.3291428,TKD, Takoradi, Takoradi, Ghana,4.896,-1.7751429,DHG, Dhigurah Centara Grand Maldives, Dhigurah, Maldives,3.594,72.8831430,ABJ, Abidjan Felix Houphouet Boigny Intl, Abidjan, Cote d'Ivoire,5.261,-3.9261431,BYK, Bouake, Bouake, Cote d'Ivoire,7.739,-5.0741432,DJO, Daloa, Daloa, Cote d'Ivoire,6.793,-6.4731433,HGO, Korhogo, Korhogo, Cote d'Ivoire,9.387,-5.5571434,MJC, Man, Man, Cote d'Ivoire,7.272,-7.5871435,SPY, San Pedro, San Pedro, Cote d'Ivoire,4.747,-6.6611436,ASK, Yamoussoukro, Yamoussoukro, Cote d'Ivoire,6.903,-5.3661437,ABV, Nnamdi Azikiwe Intl, Abuja, Nigeria,9.007,7.2631438,AKR, Akure, Akure, Nigeria,7.247,5.3011439,BNI, Benin, Benin, Nigeria,6.317,5.6001440,CBQ, Calabar, Calabar, Nigeria,4.976,8.3471441,ENU, Enugu, Enugu, Nigeria,6.474,7.5621442,QUS, Gusau, Gusau, Nigeria,12.172,6.6961443,IBA, Ibadan, Ibadan, Nigeria,7.362,3.9781444,ILR, Ilorin, Ilorin, Nigeria,8.440,4.4941445,QOW, Imo Airport, Imo, Nigeria,5.427,7.2061446,JOS, Yakubu Gowon, Jos, Nigeria,9.640,8.8691447,KAD, Kaduna, Kaduna, Nigeria,10.696,7.3201448,KAN, Mallam Aminu Intl, Kano, Nigeria,12.048,8.5251449,MIU, Maiduguri, Maiduguri, Nigeria,11.855,13.0811450,MDI, Makurdi, Makurdi, Nigeria,7.704,8.6141451,LOS, Murtala Muhammed, Lagos, Nigeria,6.577,3.3211452,MXJ, Minna New, Minna, Nigeria,9.652,6.4621453,PHC, Port Harcourt Intl, Port Hartcourt, Nigeria,5.015,6.9501454,SKO, Sadiq Abubakar Iii Intl, Sokoto, Nigeria,12.916,5.2071455,QRW, Warri Airport, Osubi, Nigeria,5.310,5.4501456,YOL, Yola, Yola, Nigeria,9.258,12.4301457,ZAR, Zaria, Zaria, Nigeria,11.130,7.6861458,MFQ, Maradi, Maradi, Niger,13.503,7.1271459,NIM, Diori Hamani, Niamey, Niger,13.482,2.1841460,THZ, Tahoua, Tahoua, Niger,14.876,5.2651461,AJY, Manu Dayak, Agadez, Niger,16.966,8.0001462,ZND, Zinder, Zinder, Niger,13.779,8.9841463,TBJ, 7 Novembre, Tabarka, Tunisia,36.978,8.8761464,MIR, Habib Bourguiba Intl, Monastir, Tunisia,35.758,10.7551465,NBE, Enfidha - Zine El Abidine Ben Ali International Airport, Enfidha, Tunisia,36.076,10.4391466,TUN, Carthage, Tunis, Tunisia,36.851,10.2271467,GAF, Gafsa, Gafsa, Tunisia,34.422,8.8231468,GAE, Gabes, Gabes, Tunisia,33.877,10.1031469,DJE, Zarzis, Djerba, Tunisia,33.875,10.7751470,EBM, El Borma, El Borma, Tunisia,31.704,9.2551471,SFA, Thyna, Sfax, Tunisia,34.718,10.6911472,TOE, Nefta, Tozeur, Tunisia,33.940,8.1111473,LRL, Niamtougou International, Niatougou, Togo,9.767,1.0911474,LFW, Gnassingbe Eyadema Intl, Lome, Togo,6.166,1.2551475,EAR, Kearney Municipal Airport, Kearney, United States,40.727,-99.0071476,ANR, Deurne, Antwerp, Belgium,51.189,4.4601477,BRU, Brussels Natl, Brussels, Belgium,50.901,4.4841478,CRL, Brussels South, Charleroi, Belgium,50.459,4.4541479,EBE, Ebenhofen BF, Ebenhofen, Germany,47.824,10.6231480,QKT, Wevelgem, Kortrijk-vevelgem, Belgium,50.817,3.2051481,LGG, Liege, Liege, Belgium,50.637,5.4431482,OST, Oostende, Ostend, Belgium,51.199,2.8621483,BBJ, Bautzen, Bautzen, Germany,51.194,14.5201484,AOC, Altenburg Nobitz, Altenburg, Germany,50.982,12.5061485,HDF, Heringsdorf Airport, Heringsdorf, Germany,53.879,14.1521486,CSO, Magdeburg-Cochstedt, Cochstedt, Germany,51.856,11.4181487,BBH, Barth, Barth, Germany,54.338,12.7001488,GTI, Guettin MecklenburgVorpommern Germany, Ruegen, Germany,54.383,13.3251489,PEF, Peenemunde Airfield, Peenemunde, Germany,54.158,13.7731490,BER, Berlin Brandenburg Willy Brandt, Berlin, Germany,52.367,13.5031491,SXF, Schonefeld, Berlin, Germany,52.380,13.5231492,DRS, Dresden, Dresden, Germany,51.133,13.7671493,ERF, Erfurt, Erfurt, Germany,50.980,10.9581494,FRA, Frankfurt Main, Frankfurt, Germany,50.026,8.5431495,FMO, Munster Osnabruck, Munster, Germany,52.135,7.6851496,HAM, Hamburg, Hamburg, Germany,53.630,9.9881497,THF, Tempelhof, Berlin, Germany,52.473,13.4041498,CGN, Koln Bonn, Cologne, Germany,50.866,7.1431499,DUS, Dusseldorf, Duesseldorf, Germany,51.289,6.7671500,MUC, Franz Josef Strauss, Munich, Germany,48.354,11.7861501,NUE, Nurnberg, Nuernberg, Germany,49.499,11.0671502,LEJ, Leipzig Halle, Leipzig, Germany,51.432,12.2421503,SCN, Saarbrucken, Saarbruecken, Germany,49.215,7.1101504,STR, Stuttgart, Stuttgart, Germany,48.690,9.2221505,TXL, Tegel, Berlin, Germany,52.560,13.2881506,HAJ, Hannover, Hannover, Germany,52.461,9.6851507,BRE, Neuenland, Bremen, Germany,53.048,8.7871508,HHN, Frankfurt Hahn, Hahn, Germany,49.949,7.2641509,MHG, Mannheim City, Mannheim, Germany,49.473,8.5141510,XFW, Hamburg Finkenwerder, Hamburg, Germany,53.536,9.8371511,KEL, Kiel Holtenau, Kiel, Germany,54.380,10.1451512,LBC, Lubeck Blankensee, Luebeck, Germany,53.805,10.7191513,HDB, Heidelberg, Heidelberg, Germany,49.393,8.6531514,FMM, Allgau, Memmingen, Germany,47.989,10.2401515,AAH, Flugplatz Merzbrueck, Aachen, Germany,50.823,6.1861516,ZCA, Arnsberg Menden, Arnsberg, Germany,51.483,7.8991517,ESS, Essen Mulheim, Essen, Germany,51.402,6.9371518,MGL, Monchengladbach, Moenchengladbach, Germany,51.230,6.5041519,PAD, Paderborn Lippstadt, Paderborn, Germany,51.614,8.6161520,NRN, Niederrhein, Weeze, Germany,51.602,6.1421521,DTM, Dortmund, Dortmund, Germany,51.518,7.6121522,AGB, Augsburg, Augsburg, Germany,48.425,10.9321523,OBF, Oberpfaffenhofen, Oberpfaffenhofen, Germany,48.081,11.2831524,FDH, Friedrichshafen, Friedrichshafen, Germany,47.671,9.5111525,SZW, Schwerin Parchim, Parchim, Germany,53.427,11.7831526,ZSN, Stendal Borstel, Stendal, Germany,52.628,11.8181527,BYU, Bayreuth, Bayreuth, Germany,49.984,11.6391528,HOQ, Hof Plauen, Hof, Germany,50.289,11.8551529,ZNV, Koblenz Winningen, Koblenz, Germany,50.326,7.5291530,ZQF, Trier Fohren, Trier, Germany,49.864,6.7881531,ZQC, Speyer, Speyer, Germany,49.303,8.4511532,FKB, Baden Airpark, Karlsruhe/Baden-Baden, Germany,48.779,8.0801533,ZQL, Donaueschingen Villingen, Donaueschingen, Germany,47.973,8.5221534,LHA, Lahr Airport, Lahr, Germany,48.369,7.8281535,BWE, Braunschweig Wolfsburg, Braunschweig, Germany,52.319,10.5561536,KSF, Kassel Calden, Kassel, Germany,51.408,9.3781537,BRV, Bremerhaven, Bremerhaven, Germany,53.507,8.5731538,EME, Emden, Emden, Germany,53.391,7.2271539,AGE, Wangerooge Airport, Wangerooge, Germany,53.783,7.9141540,WVN, Wilhelmshaven Mariensiel, Wilhelmshaven, Germany,53.505,8.0531541,JUI, Verkehrslandeplatz Juist, Juist, Germany,53.682,7.0561542,LGO, Langeoog Airport, Langeoog, Germany,53.743,7.4981543,BMK, Borkum, Borkum, Germany,53.596,6.7091544,NOE, Sonderlandeplatz Norden-Norddeich, Norden, Germany,53.632,7.1911545,NRD, Norderney, Norderney, Germany,53.707,7.2301546,HEI, Heide-Bsum Airport, Bsum, Germany,54.153,8.9021547,FLF, Flensburg Schaferhaus, Flensburg, Germany,54.772,9.3781548,HGL, Helgoland-Dne Airport, Helgoland, Germany,54.185,7.916