id,code,name,city,country,latitude,longitude1,IFP, Laughlin-Bullhead Intl, Bullhead, United States,35.157,-114.5602,IGM, Kingman Airport, Kingman, United States,35.260,-113.9383,IGS, Ingolstadt BF, Ingolstadt, Germany,48.778,11.4224,IRU, Hilton Iru fushi, Maldives Hilton Iru fushi, Maldives,5.744,73.3255,ECA, Iosco County, East Tawas, United States,44.311,-83.4226,AAF, Apalachicola Regional Airport, Apalachicola, United States,29.728,-85.0277,ABE, Lehigh Valley Intl, Allentown, United States,40.652,-75.4418,ABI, Abilene Rgnl, Abilene, United States,32.411,-99.6829,ABQ, Albuquerque International Sunport, Albuquerque, United States,35.040,-106.60910,ABR, Aberdeen Regional Airport, Aberdeen, United States,45.449,-98.42211,ABY, Southwest Georgia Regional Airport, Albany, United States,31.536,-84.19512,ACK, Nantucket Mem, Nantucket, United States,41.253,-70.06013,ACT, Waco Rgnl, Waco, United States,31.611,-97.23114,ACV, Arcata, Arcata CA, United States,40.978,-124.10915,ACY, Atlantic City Intl, Atlantic City, United States,39.458,-74.57716,ADM, Ardmore Muni, Ardmore, United States,34.301,-97.00917,ADS, Addison, Addison, United States,32.969,-96.83618,ADW, Andrews Afb, Camp Springs, United States,38.811,-76.86719,AEX, Alexandria Intl, Alexandria, United States,31.327,-92.55020,AFW, Fort Worth Alliance Airport, Fort Worth, United States,32.988,-97.31921,AGC, Allegheny County Airport, Pittsburgh, United States,40.354,-79.93022,AGS, Augusta Rgnl At Bush Fld, Bush Field, United States,33.370,-81.96523,AHN, Athens Ben Epps Airport, Athens, United States,33.949,-83.32624,AIA, Alliance Municipal Airport, Alliance, United States,42.053,-102.80425,AIK, Municipal Airport, Aiken, United States,33.649,-81.68526,AIZ, Lee C Fine Memorial Airport, Kaiser Lake Ozark, United States,38.096,-92.54927,AKC, Akron Fulton Intl, Akron, United States,41.038,-81.46728,ALB, Albany Intl, Albany, United States,42.748,-73.80229,ALI, Alice Intl, Alice, United States,27.741,-98.02730,ALM, Alamogordo White Sands Regional Airport, Alamogordo, United States,32.840,-105.99131,ALO, Waterloo Regional Airport, Waterloo, United States,42.557,-92.40032,ALS, San Luis Valley Regional Airport, Alamosa, United States,37.435,-105.86733,ALW, Walla Walla Regional Airport, Walla Walla, United States,46.095,-118.28834,AMA, Rick Husband Amarillo Intl, Amarillo, United States,35.219,-101.70635,ANB, Anniston Metro, Anniston, United States,33.588,-85.85836,AND, Anderson Rgnl, Andersen, United States,34.495,-82.70937,ANP, Lee Airport, Annapolis, United States,38.943,-76.56838,ANQ, Tri-State Steuben County Airport, Angola, United States,41.640,-85.08339,AOH, Lima Allen County Airport, Lima, United States,40.707,-84.02740,AOO, Altoona Blair Co, Altoona, United States,40.296,-78.32041,APA, Centennial, Denver, United States,39.570,-104.84942,APC, Napa County Airport, Napa, United States,38.213,-122.28143,APF, Naples Muni, Naples, United States,26.153,-81.77544,APG, Phillips Aaf, Aberdeen, United States,39.466,-76.16945,APN, Alpena County Regional Airport, Alpena, United States,45.078,-83.56046,ARA, Acadiana Rgnl, Louisiana, United States,30.038,-91.88447,ARB, Ann Arbor Municipal Airport, Ann Arbor, United States,42.132,-83.44448,ART, Watertown Intl, Watertown, United States,43.992,-76.02249,ARV, Lakeland, Minocqua - Woodruff, United States,45.928,-89.73150,ASE, Aspen Pitkin County Sardy Field, Aspen, United States,39.223,-106.86951,ASH, Boire Field Airport, Nashua, United States,42.782,-71.51552,AST, Astoria Regional Airport, Astoria, United States,46.158,-123.87953,ATL, Hartsfield Jackson Atlanta Intl, Atlanta, United States,33.637,-84.42854,ATT, Camp Mabry Austin City, Austin TX, United States,30.317,-97.76755,ATW, Appleton, Appleton, United States,44.258,-88.50856,ATY, Watertown Regional Airport, Watertown, United States,44.914,-97.15557,KFX, Kaufbeuren BF, Kaufbeuren, Germany,47.885,10.62958,AUG, Augusta State, Augusta, United States,44.321,-69.79759,AUS, Austin Bergstrom Intl, Austin, United States,30.195,-97.67060,AVL, Asheville Regional Airport, Asheville, United States,35.436,-82.54261,AVO, Executive, Avon Park, United States,27.591,-81.52962,AVP, Wilkes Barre Scranton Intl, Scranton, United States,41.338,-75.72363,AVW, Marana Regional, Tucson, United States,32.410,-111.21864,AVX, Avalon, Catalina Island, United States,33.405,-118.41665,AZO, Kalamazoo, Kalamazoo, United States,42.235,-85.55266,BAB, Beale Afb, Marysville, United States,39.136,-121.43767,BAD, Barksdale Afb, Shreveport, United States,32.502,-93.66368,BAF, Barnes Municipal, Westfield, United States,42.158,-72.71669,BKG, Branson LLC, Branson, United States,36.532,-93.20170,BCE, Bryce Canyon, Bryce Canyon, United States,37.706,-112.14671,BCT, Boca Raton, Boca Raton, United States,26.379,-80.10872,BDE, Baudette Intl, Baudette, United States,48.728,-94.61273,BDL, Bradley Intl, Windsor Locks, United States,41.939,-72.68374,BDR, Igor I Sikorsky Mem, Stratford, United States,41.163,-73.12675,WBU, Boulder Municipal, Boulder, United States,40.039,-105.22676,BEC, Beech Factory Airport, Wichita, United States,37.694,-97.21577,BED, Laurence G Hanscom Fld, Bedford, United States,42.470,-71.28978,BFD, Bradford Regional Airport, Bradford, United States,41.803,-78.64079,BFF, Western Nebraska Regional Airport, Scottsbluff, United States,41.874,-103.59680,BFI, Boeing Fld King Co Intl, Seattle, United States,47.530,-122.30281,BFL, Meadows Fld, Bakersfield, United States,35.434,-119.05782,BFM, Mobile Downtown, Mobile, United States,30.627,-88.06883,BFP, Beaver Falls, Beaver Falls, United States,40.772,-80.39184,BFT, BFT County Airport, Beauford, United States,32.411,-80.63585,BGE, Decatur County Industrial Air Park, Bainbridge, United States,30.972,-84.63786,BGM, Greater Binghamton Edwin A Link Fld, Binghamton, United States,42.209,-75.98087,BGR, Bangor Intl, Bangor, United States,44.807,-68.82888,BHB, Hancock County - Bar Harbor, Bar Harbor, United States,44.450,-68.36289,BHM, Birmingham Intl, Birmingham, United States,33.563,-86.75490,BID, Block Island State Airport, Block Island, United States,41.168,-71.57891,BIF, Biggs Aaf, El Paso, United States,31.850,-106.38092,BIL, Billings Logan International Airport, Billings, United States,45.809,-108.53893,BIS, Bismarck Municipal Airport, Bismarck, United States,46.776,-100.75894,BIV, Tulip City Airport, Holland, United States,42.743,-86.10895,BIX, Keesler Afb, Biloxi, United States,30.410,-88.92496,BJC, Rocky Mountain Metropolitan Airport, Broomfield-CO, United States,39.909,-105.11797,BJI, Bemidji Regional Airport, Bemidji, United States,47.511,-94.93598,BKD, Stephens Co, Breckenridge, United States,32.719,-98.89199,BKF, Buckley Afb, Buckley, United States,39.702,-104.752100,BKL, Burke Lakefront Airport, Cleveland, United States,41.518,-81.683101,BKW, Raleigh County Memorial Airport, Beckley, United States,37.787,-81.124102,BLH, Blythe Airport, Blythe, United States,33.619,-114.717103,BLI, Bellingham Intl, Bellingham, United States,48.793,-122.538104,BLV, Scott Afb Midamerica, Belleville, United States,38.545,-89.835105,BMC, Brigham City, Brigham City, United States,41.552,-112.062106,BMG, Monroe County Airport, Bloomington, United States,39.146,-86.617107,BMI, Central Illinois Rgnl, Bloomington, United States,40.477,-88.916108,BMQ, Bamburi, Bamburi, Kenya,-3.983,39.731109,BNA, Nashville Intl, Nashville, United States,36.124,-86.678110,BOI, Boise Air Terminal, Boise, United States,43.564,-116.223111,BOS, General Edward Lawrence Logan Intl, Boston, United States,42.364,-71.005112,BOW, Bartow Municipal Airport, Bartow, United States,27.943,-81.783113,BPT, Southeast Texas Rgnl, Beaumont, United States,29.951,-94.021114,BQK, Brunswick Golden Isles Airport, Brunswick, United States,31.259,-81.467115,BRD, Brainerd Lakes Rgnl, Brainerd, United States,46.398,-94.138116,BRL, Southeast Iowa Regional Airport, Burlington, United States,40.783,-91.126117,BRO, Brownsville South Padre Island Intl, Brownsville, United States,25.907,-97.426118,BTM, Bert Mooney Airport, Butte, United States,45.955,-112.497119,BTR, Baton Rouge Metro Ryan Fld, Baton Rouge, United States,30.533,-91.150120,BTV, Burlington Intl, Burlington, United States,44.472,-73.153121,BUF, Buffalo Niagara Intl, Buffalo, United States,42.941,-78.732122,BUR, Bob Hope, Burbank, United States,34.201,-118.359123,BUU, Municipal Airport, Burlington, United States,42.691,-88.305124,BUY, Burlington-Alamance Regional Airport, Burlington, United States,36.049,-79.475125,BLD, Boulder City Municipal Airport, Boulder City, United States,35.565,-114.514126,BVY, Beverly Municipal Airport, Beverly, United States,42.584,-70.916127,BWG, Bowling Green-Warren County Regional Airport, Bowling Green, United States,36.965,-86.420128,BWI, Baltimore Washington Intl, Baltimore, United States,39.175,-76.668129,BXK, Buckeye Municipal Airport, Buckeye, United States,33.420,-112.686130,BXS, Borrego Valley Airport, Borrego Springs, United States,33.259,-116.321131,BYH, Arkansas Intl, Blytheville, United States,35.964,-89.944132,BYS, Bicycle Lake Aaf, Fort Irwin, United States,35.281,-116.630133,BZN, Gallatin Field, Bozeman, United States,45.778,-111.160134,CAE, Columbia Metropolitan, Columbia, United States,33.939,-81.120135,CAK, Akron Canton Regional Airport, Akron, United States,40.916,-81.442136,CAR, Caribou Muni, Caribou, United States,46.872,-68.018137,CBE, Greater Cumberland Rgnl., Cumberland, United States,39.615,-78.761138,CBM, Columbus Afb, Colombus, United States,33.644,-88.444139,CCO, Coweta County Airport, Newnan, United States,33.312,-84.770140,CCR, Buchanan Field Airport, Concord, United States,37.990,-122.057141,CDC, Cedar City Rgnl, Cedar City, United States,37.701,-113.099142,CDK, CedarKey, Cedar Key, United States,29.134,-83.050143,CDN, Woodward Field, Camden, United States,34.284,-80.565144,CDR, Chadron Municipal Airport, Chadron, United States,42.838,-103.096145,CDS, Childress Muni, Childress, United States,34.434,-100.288146,CDW, Caldwell Essex County Airport, Caldwell, United States,40.875,-74.281147,CEC, Del Norte County Airport, Crescent City, United States,41.780,-124.237148,CEF, Westover Arb Metropolitan, Chicopee Falls, United States,42.194,-72.535149,CEU, Clemson, Clemson, United States,34.672,-82.886150,CEW, Bob Sikes, Crestview, United States,30.779,-86.522151,CEZ, Cortez Muni, Cortez, United States,37.303,-108.628152,CFD, Coulter Fld, Bryan, United States,30.716,-96.331153,CGF, Cuyahoga County, Richmond Heights, United States,41.565,-81.486154,CGI, Cape Girardeau Regional Airport, Cape Girardeau, United States,37.225,-89.571155,CGX, Meigs Field, Chicago, United States,41.860,-87.610156,CGZ, Casa Grande Municipal Airport, Casa Grande, United States,32.955,-111.767157,CHA, Lovell Fld, Chattanooga, United States,35.035,-85.204158,CHO, Charlottesville-Albemarle, Charlottesville VA, United States,38.139,-78.453159,CHS, Charleston Afb Intl, Charleston, United States,32.899,-80.041160,CIC, Chico Muni, Chico, United States,39.795,-121.858161,CID, Cedar Rapids, Cedar Rapids, United States,41.885,-91.711162,CIU, Chippewa County International Airport, Sault Ste Marie, United States,46.251,-84.472163,CKB, Harrison Marion Regional Airport, Clarksburg, United States,39.297,-80.228164,GRM, Grand Marais Cook County Airport, Grand Marais, United States,47.838,-90.383165,CKF, Crisp County Cordele Airport, Cordele, United States,31.989,-83.774166,CKV, Clarksville-Montgomery County Regional Airport, Clarksville, United States,36.622,-87.415167,CLE, Cleveland Hopkins Intl, Cleveland, United States,41.412,-81.850168,CLL, Easterwood Fld, College Station, United States,30.589,-96.364169,CLM, William R Fairchild International Airport, Port Angeles, United States,48.120,-123.500170,CLT, Charlotte Douglas Intl, Charlotte, United States,35.214,-80.943171,CLW, Clearwater Air Park, Clearwater, United States,27.976,-82.759172,CMH, Port Columbus Intl, Columbus, United States,39.998,-82.892173,CMI, Champaign, Champaign, United States,40.039,-88.278174,CMX, Houghton County Memorial Airport, Hancock, United States,47.168,-88.489175,CNM, Cavern City Air Terminal, Carlsbad, United States,32.337,-104.263176,CNW, Tstc Waco, Waco, United States,31.638,-97.074177,CNY, Canyonlands Field, Moab, United States,38.755,-109.755178,COD, Yellowstone Rgnl, Cody, United States,44.520,-109.024179,COF, Patrick Afb, Coco Beach, United States,28.235,-80.610180,COS, City Of Colorado Springs Muni, Colorado Springs, United States,38.806,-104.701181,COT, Cotulla Lasalle Co, Cotulla, United States,28.457,-99.220182,COU, Columbia Rgnl, Columbia, United States,38.818,-92.220183,CPR, Natrona Co Intl, Casper, United States,42.908,-106.464184,CRP, Corpus Christi Intl, Corpus Christi, United States,27.770,-97.501185,CLD, McClellan-Palomar Airport, Carlsbad, United States,33.074,-117.165186,CRW, Yeager, Charleston, United States,38.373,-81.593187,CSG, Columbus Metropolitan Airport, Columbus, United States,32.516,-84.939188,CTB, Cut Bank Muni, Cutbank, United States,48.608,-112.376189,CTJ, West Georgia Regional Airport - O V Gray Field, Carrollton, United States,33.632,-85.152190,CTY, Cross City, Cross City, United States,29.636,-83.105191,CVG, Cincinnati Northern Kentucky Intl, Cincinnati, United States,39.049,-84.668192,CVN, Clovis Muni, Clovis, United States,34.425,-103.079193,CVS, Cannon Afb, Clovis, United States,34.383,-103.322194,CVX, Charlevoix Municipal Airport, Charelvoix, United States,45.305,-85.275195,CWA, Central Wisconsin, Wassau, United States,44.773,-89.647196,CWI, Clinton Municipal, Clinton, United States,41.831,-90.329197,CXL, Calexico Intl, Calexico, United States,32.670,-115.513198,CXO, Lone Star Executive, Conroe, United States,30.352,-95.414199,CXY, Capital City Airport, Harrisburg, United States,40.217,-76.851200,CYS, Cheyenne Rgnl Jerry Olson Fld, Cheyenne, United States,41.156,-104.812201,DAB, Daytona Beach Intl, Daytona Beach, United States,29.180,-81.058202,DAL, Dallas Love Fld, Dallas, United States,32.847,-96.852203,DAY, James M Cox Dayton Intl, Dayton, United States,39.902,-84.219204,DBQ, Dubuque Rgnl, Dubuque IA, United States,42.402,-90.709205,DCA, Ronald Reagan Washington Natl, Washington, United States,38.852,-77.038206,DDC, Dodge City Regional Airport, Dodge City, United States,37.763,-99.966207,DEC, Decatur, Decatur, United States,39.835,-88.866208,DEN, Denver Intl, Denver, United States,39.862,-104.673209,DET, Coleman A Young Muni, Detroit, United States,42.409,-83.010210,DFW, Dallas Fort Worth Intl, Dallas-Fort Worth, United States,32.897,-97.038211,DGL, Douglas Municipal Airport, Douglas, United States,31.343,-109.506212,DHN, Dothan Rgnl, Dothan, United States,31.321,-85.450213,DHT, Dalhart Muni, Dalhart, United States,36.023,-102.547214,DIK, Dickinson Theodore Roosevelt Regional Airport, Dickinson, United States,46.798,-102.802215,DKK, Chautauqua County-Dunkirk Airport, Dunkirk, United States,42.493,-79.272216,DKX, Knoxville Downtown Island Airport, Knoxville, United States,35.964,-83.874217,DLF, Laughlin Afb, Del Rio, United States,29.359,-100.778218,DLH, Duluth Intl, Duluth, United States,46.842,-92.194219,DLL, Baraboo Wisconsin Dells Airport, Baraboo, United States,43.522,-89.771220,DMA, Davis Monthan Afb, Tucson, United States,32.166,-110.883221,DNL, Daniel Field Airport, Augusta, United States,33.467,-82.039222,DNN, Dalton Municipal Airport, Dalton, United States,34.723,-84.870223,DOV, Dover Afb, Dover, United States,39.130,-75.466224,DPA, Dupage, West Chicago, United States,41.908,-88.249225,DQH, Douglas Municipal Airport, Douglas, United States,31.477,-82.861226,DRI, Beauregard Rgnl, Deridder, United States,30.832,-93.340227,DRM, Drummond Island Airport, Drummond Island, United States,46.009,-83.744228,DRO, Durango La Plata Co, Durango, United States,37.152,-107.754229,DRT, Del Rio Intl, Del Rio, United States,29.374,-100.927230,DSM, Des Moines Intl, Des Moines, United States,41.534,-93.663231,DTA, Delta Municipal Airport, Delta, United States,39.381,-112.508232,DTS, Destin, Destin, United States,30.400,-86.471233,DTW, Detroit Metro Wayne Co, Detroit, United States,42.212,-83.353234,DUC, Halliburton Field Airport, Duncan, United States,34.471,-97.960235,DUG, Bisbee Douglas Intl, Douglas, United States,31.469,-109.604236,DUJ, DuBois Regional Airport, Du Bois, United States,41.178,-78.899237,DVL, Devils Lake Regional Airport, Devils Lake, United States,48.114,-98.909238,DVT, Deer Valley Municipal Airport, Phoenix , United States,33.412,112.457239,DWA, Yolo County Airport, Davis-Woodland-Winters, United States,38.579,-121.857240,DWH, David Wayne Hooks Field, Houston, United States,30.064,-95.554241,DXR, Danbury Municipal Airport, Danbury, United States,41.372,-73.482242,DYS, Dyess Afb, Abilene, United States,32.421,-99.855243,E25, Wickenburg Municipal Airport, Wickenburg, United States,33.969,-112.799244,E63, Gila Bend Municipal Airport, Gila Bend, United States,32.960,-112.674245,EAT, Pangborn Field, Wenatchee, United States,47.398,-120.206246,EAU, Chippewa Valley Regional Airport, Eau Claire, United States,44.866,-91.484247,ECG, Elizabeth City Cgas Rgnl, Elizabeth City, United States,36.261,-76.175248,ECP, Panama City-NW Florida Bea., Panama City, United States,30.342,-85.797249,EDW, Edwards Afb, Edwards Afb, United States,34.905,-117.884250,EET, Shelby County Airport, Alabaster, United States,33.178,-86.783251,EFD, Ellington Fld, Houston, United States,29.607,-95.159252,EGE, Eagle Co Rgnl, Vail, United States,39.643,-106.918253,EGT, Wellington Municipal, Wellington, United States,37.394,-97.423254,EGV, Eagle River, Eagle River, United States,45.932,-89.268255,EKN, Elkins Randolph Co Jennings Randolph, Elkins, United States,38.889,-79.857256,EKO, Elko Regional Airport, Elko, United States,40.825,-115.792257,ELD, South Arkansas Rgnl At Goodwin Fld, El Dorado, United States,33.221,-92.813258,ELM, Elmira Corning Rgnl, Elmira, United States,42.160,-76.892259,LYU, Ely Municipal, Ely, United States,47.824,-91.831260,ELP, El Paso Intl, El Paso, United States,31.807,-106.378261,ELY, Ely Airport, Ely, United States,39.300,-114.842262,KEX, Kempten HBF, Kempten, Germany,47.724,10.311263,END, Vance Afb, Enid, United States,36.339,-97.917264,ENV, Wendover, Wendover, United States,40.719,-114.031265,EOK, Keokuk Municipal Airport, Keokuk, United States,40.460,-91.429266,EPM, Eastport Municipal Airport, Eastport, United States,44.910,-67.013267,ERI, Erie Intl Tom Ridge Fld, Erie, United States,42.082,-80.176268,ERV, Kerrville Municipal Airport, Kerrville, United States,29.977,-99.085269,ERY, Luce County Airport, Newberry, United States,46.311,-85.457270,ESC, Delta County Airport, Escanaba, United States,45.723,-87.094271,ESF, Esler Rgnl, Alexandria, United States,31.395,-92.296272,ESN, Easton-Newnam Field Airport, Easton, United States,38.804,-76.069273,EUG, Mahlon Sweet Fld, Eugene, United States,44.125,-123.212274,EVV, Evansville Regional, Evansville, United States,38.037,-87.532275,EWB, New Bedford Regional Airport, New Bedford, United States,41.676,-70.957276,EWN, Craven Co Rgnl, New Bern, United States,35.073,-77.043277,EWR, Newark Liberty Intl, Newark, United States,40.693,-74.169278,EYW, Key West Intl, Key West, United States,24.556,-81.760279,RBK, French Valley Airport, Murrieta-Temecula, United States,33.574,-117.128280,FAF, Felker Aaf, Fort Eustis, United States,37.133,-76.609281,FAR, Hector International Airport, Fargo, United States,46.921,-96.816282,FAT, Fresno Yosemite Intl, Fresno, United States,36.776,-119.718283,FAY, Fayetteville Regional Grannis Field, Fayetteville, United States,34.991,-78.880284,FCA, Glacier Park Intl, Kalispell, United States,48.310,-114.256285,FCS, Butts Aaf, Fort Carson, United States,38.678,-104.757286,FDY, Findlay Airport, Findley, United States,41.012,-83.669287,FFA, First Flight Airport, Kill Devil Hills, United States,36.020,-75.670288,FFC, Atlanta Regional Airport - Falcon Field, Atlanta, United States,33.357,-84.572289,FFO, Wright Patterson Afb, Dayton, United States,39.826,-84.048290,FFT, Capital City Airport, Frankfort, United States,38.182,-84.906291,FFZ, Mesa Falcon Field, Mesa, United States,33.461,-111.728292,FRD, Friday Harbor Airport, Friday Harbor, United States,48.522,-123.024293,FHU, Sierra Vista Muni Libby Aaf, Fort Huachuca, United States,31.588,-110.344294,FIT, Fitchburg Municipal Airport, Fitchburg, United States,42.554,-71.759295,FKL, Franklin, Franklin, United States,41.378,-79.860296,FLD, Fond Du Lac County Airport, Fond du Lac, United States,43.771,-88.488297,FLG, Flagstaff Pulliam Airport, Flagstaff, United States,35.140,-111.669298,FLL, Fort Lauderdale Hollywood Intl, Fort Lauderdale, United States,26.073,-80.153299,FLO, Florence Rgnl, Florence, United States,34.185,-79.724300,FLV, Sherman Aaf, Fort Leavenworth, United States,39.368,-94.915301,FME, Tipton, Fort Meade, United States,39.085,-76.759302,FMH, Otis Angb, Falmouth, United States,41.658,-70.521303,FMN, Four Corners Rgnl, Farmington, United States,36.741,-108.230304,FMY, Page Fld, Fort Myers, United States,26.587,-81.863305,FNL, Fort Collins Loveland Muni, Fort Collins, United States,40.452,-105.011306,FNT, Bishop International, Flint, United States,42.965,-83.744307,FOD, Fort Dodge Rgnl, Fort Dodge, United States,42.551,-94.192308,FOE, Forbes Fld, Topeka, United States,38.951,-95.664309,FOK, Francis S Gabreski, West Hampton Beach, United States,40.844,-72.632310,FRP, St Lucie County International Airport, Fort Pierce, United States,27.497,-80.373311,FRI, Marshall Aaf, Fort Riley, United States,39.055,-96.764312,FSD, Sioux Falls, Sioux Falls, United States,43.582,-96.742313,FSI, Henry Post Aaf, Fort Sill, United States,34.650,-98.402314,FSM, Fort Smith Rgnl, Fort Smith, United States,35.337,-94.367315,FST, Fort Stockton Pecos Co, Fort Stockton, United States,30.916,-102.916316,FTK, Godman Aaf, Fort Knox, United States,37.907,-85.972317,FTW, Fort Worth Meacham Intl, Fort Worth, United States,32.820,-97.362318,FTY, Fulton County Airport Brown Field, Atlanta, United States,33.779,-84.521319,FUL, Fullerton Municipal Airport, Fullerton, United States,33.522,-117.585320,WFK, Northern Aroostook Regional Airport, Frenchville, United States,47.286,-68.313321,FWA, Fort Wayne, Fort Wayne, United States,40.978,-85.195322,RWL, Rawlins Municipal Airport-Harvey Field, Rawlins, United States,41.806,-107.200323,FXE, Fort Lauderdale Executive, Fort Lauderdale, United States,26.197,-80.171324,FYV, Drake Fld, Fayetteville, United States,36.005,-94.170325,FZG, Fitzgerald Municipal Airport, Fitzgerald, United States,31.684,-83.271326,GAD, Northeast Alabama Regional Airport, Gadsden, United States,33.973,-86.089327,GAI, Montgomery County Airpark, Gaithersburg, United States,39.101,-77.096328,GBN, Great Bend Municipal, Great Bend, United States,38.344,-98.859329,GCC, Gillette-Campbell County Airport, Gillette, United States,44.349,-105.539330,GCK, Garden City Rgnl, Garden City, United States,37.928,-100.724331,GCN, Grand Canyon National Park Airport, Grand Canyon, United States,35.952,-112.147332,GDV, Dawson Community Airport, Glendive, United States,47.139,-104.807333,GDW, Gladwin Zettel Memorial Airport, Gladwin, United States,43.971,-84.475334,GED, Sussex Co, Georgetown, United States,38.689,-75.359335,GEG, Spokane Intl, Spokane, United States,47.620,-117.534336,GFK, Grand Forks Intl, Grand Forks, United States,47.949,-97.176337,GGE, Georgetown County Airport, Georgetown, United States,33.311,-79.320338,GGG, East Texas Rgnl, Longview, United States,32.384,-94.711339,GGW, Wokal Field Glasgow International Airport, Glasgow, United States,48.213,-106.615340,GHG, Marshfield Municipal Airport, Marshfield, United States,42.098,-70.672341,GIF, Gilbert Airport, Winter Haven, United States,28.063,-81.753342,GJT, Grand Junction Regional, Grand Junction, United States,39.122,-108.527343,GKY, Arlington Municipal, Arlington, United States,32.664,-97.094344,GLD, Renner Fld, Goodland, United States,39.371,-101.699345,GLS, Scholes Intl At Galveston, Galveston, United States,29.265,-94.860346,GNT, Grants Milan Muni, Grants, United States,35.167,-107.902347,GNV, Gainesville Rgnl, Gainesville, United States,29.690,-82.272348,GON, Groton New London, Groton CT, United States,41.330,-72.045349,GPT, Gulfport-Biloxi, Gulfport, United States,30.407,-89.070350,GPZ, Grand Rapids Itasca County, Grand Rapids MN, United States,47.211,-93.510351,GQQ, Galion Municipal Airport, Galion, United States,40.753,-82.724352,GRB, Austin Straubel Intl, Green Bay, United States,44.485,-88.130353,GRF, Gray Aaf, Fort Lewis, United States,47.079,-122.581354,GRI, Central Nebraska Regional Airport, Grand Island, United States,40.968,-98.310355,GRK, Robert Gray Aaf, Killeen, United States,31.067,-97.829356,GRR, Gerald R Ford Intl, Grand Rapids, United States,42.881,-85.523357,GSB, Seymour Johnson Afb, Goldsboro, United States,35.339,-77.961358,GSO, Piedmont Triad, Greensboro, United States,36.098,-79.937359,GSP, Greenville-Spartanburg International, Greenville, United States,34.896,-82.219360,GTB, Wheeler Sack Aaf, Fort Drum, United States,44.056,-75.719361,GTF, Great Falls Intl, Great Falls, United States,47.482,-111.371362,GTR, Golden Triangle Regional Airport, Columbus Mississippi, United States,33.450,-88.591363,GTU, Georgetown Municipal Airport, Georgetown, United States,30.679,-97.679364,GUC, Gunnison - Crested Butte, Gunnison, United States,38.534,-106.933365,GUP, Gallup Muni, Gallup, United States,35.511,-108.789366,GUS, Grissom Arb, Peru, United States,40.648,-86.152