id,code,name,city,country,latitude,longitude2470,TNF, Toussus Le Noble, Toussous-le-noble, France,48.752,2.1062471,ORY, Orly, Paris, France,48.725,2.3592472,POX, Cormeilles En Vexin, Pontoise, France,49.097,2.0412473,QYR, Barberey, Troyes, France,48.322,4.0172474,NVS, Fourchambault, Nevers, France,47.003,3.1132475,LIL, Lesquin, Lille, France,50.562,3.0892476,BES, Guipavas, Brest, France,48.448,-4.4192477,CER, Maupertus, Cherbourg, France,49.650,-1.4702478,DNR, Pleurtuit, Dinard, France,48.588,-2.0802479,GFR, Granville, Granville, France,48.883,-1.5642480,DOL, St Gatien, Deauville, France,49.365,0.1542481,LRT, Lann Bihoue, Lorient, France,47.761,-3.4402482,EDM, Les Ajoncs, La Roche-sur-yon, France,46.702,-1.3792483,CFR, Carpiquet, Caen, France,49.173,-0.4502484,LME, Arnage, Le Mans, France,47.949,0.2022485,RNS, St Jacques, Rennes, France,48.070,-1.7352486,LAI, Lannion, Lannion, France,48.754,-3.4722487,UIP, Pluguffan, Quimper, France,47.975,-4.1682488,NTE, Nantes Atlantique, Nantes, France,47.153,-1.6112489,SBK, Armor, St.-brieuc Armor, France,48.538,-2.8542490,MXN, Ploujean, Morlaix, France,48.603,-3.8162491,VNE, Meucon, Vannes, France,47.723,-2.7192492,SNR, Montoir, St.-nazaire, France,47.312,-2.1492493,MLH, Bale Mulhouse, Mulhouse, France,47.590,7.5302494,DIJ, Longvic, Dijon, France,47.269,5.0902495,MZM, Frescaty, Metz, France,49.072,6.1322496,EPL, Mirecourt, Epinal, France,48.325,6.0702497,ENC, Essey, Nancy, France,48.692,6.2302498,RHE, Champagne, Reims, France,49.310,4.0502499,SXB, Entzheim, Strasbourg, France,48.538,7.6282500,TLN, Le Palyvestre, Hyeres, France,43.097,6.1462501,FRJ, Frejus Saint Raphael, Frejus, France,43.417,6.7332502,FNI, Garons, Nimes, France,43.757,4.4162503,LTT, La Mle Airport, La Mle, France,43.205,6.4822504,MQC, Miquelon, Miquelon, Saint Pierre and Miquelon,47.095,-56.3802505,FSP, St Pierre, St.-pierre, Saint Pierre and Miquelon,46.763,-56.1732506,PYR, Andravida, Andravida, Greece,37.921,21.2932507,AGQ, Agrinion, Agrinion, Greece,38.602,21.3512508,AXD, Dimokritos, Alexandroupolis, Greece,40.856,25.9562509,ATH, Eleftherios Venizelos Intl, Athens, Greece,37.936,23.9442510,VOL, Nea Anchialos, Nea Anghialos, Greece,39.220,22.7942511,JKH, Chios, Chios, Greece,38.343,26.1412512,PKH, Alexion, Porto Heli, Greece,37.299,23.1492513,JIK, Ikaria, Ikaria, Greece,37.683,26.3472514,IOA, Ioannina, Ioannina, Greece,39.696,20.8232515,HER, Nikos Kazantzakis, Heraklion, Greece,35.340,25.1802516,KSO, Aristotelis, Kastoria, Greece,40.446,21.2822517,KIT, Kithira, Kithira, Greece,36.274,23.0172518,EFL, Kefallinia, Keffallinia, Greece,38.120,20.5002519,KZS, Kastelorizo, Kastelorizo, Greece,36.128,29.5672520,KLX, Kalamata, Kalamata, Greece,37.068,22.0262521,KGS, Kos, Kos, Greece,36.793,27.0922522,AOK, Karpathos, Karpathos, Greece,35.421,27.1462523,CFU, Ioannis Kapodistrias Intl, Kerkyra/corfu, Greece,39.602,19.9122524,KSJ, Kasos, Kasos, Greece,35.421,26.9102525,KVA, Megas Alexandros Intl, Kavala, Greece,40.913,24.6192526,JKL, Kalymnos Island, Kalymnos, Greece,36.963,26.9412527,KZI, Filippos, Kozani, Greece,40.286,21.8412528,LRS, Leros, Leros, Greece,37.185,26.8002529,LXS, Limnos, Limnos, Greece,39.917,25.2362530,LRA, Larisa, Larissa, Greece,39.650,22.4662531,JMK, Mikonos, Mykonos, Greece,37.435,25.3482532,MLO, Milos, Milos, Greece,36.696,24.4782533,MJT, Mitilini, Mytilini, Greece,39.057,26.5982534,JNX, Naxos, Cyclades Islands, Greece,37.081,25.3682535,PAS, Paros, Paros, Greece,37.010,25.1282536,JTY, Astypalaia, Astypalaia, Greece,36.580,26.3762537,PVK, Aktio, Preveza, Greece,38.925,20.7652538,RHO, Rhodes Diagoras, Rhodos, Greece,36.405,28.0862539,GPA, Araxos, Patras, Greece,38.151,21.4262540,CHQ, Souda, Chania, Greece,35.532,24.1502541,JSI, Alexandros Papadiamantis, Skiathos, Greece,39.177,23.5042542,SMI, Samos, Samos, Greece,37.690,26.9122543,JSY, Syros Airport, Syros Island, Greece,37.423,24.9512544,JTR, Santorini, Thira, Greece,36.399,25.4792545,JSH, Sitia, Sitia, Greece,35.216,26.1012546,SKU, Skiros, Skiros, Greece,38.968,24.4872547,SKG, Makedonia, Thessaloniki, Greece,40.520,22.9712548,ZTH, Dionysios Solomos, Zakynthos, Greece,37.751,20.8842549,BUD, Ferihegy, Budapest, Hungary,47.437,19.2562550,DEB, Debrecen, Debrecen, Hungary,47.489,21.6152551,PEV, Pcs-Pogny Airport, Pcs-Pogny, Hungary,45.991,18.2412552,QGY, Gy_r-Pr International Airport, Gy_r, Hungary,47.627,17.8082553,SOB, Srmellk International Airport, Srmellk, Hungary,46.686,17.1592554,CRV, Crotone, Crotone, Italy,38.997,17.0802555,BRI, Bari, Bari, Italy,41.139,16.7612556,FOG, Gino Lisa, Foggia, Italy,41.433,15.5352557,TAR, Grottaglie, Grottaglie, Italy,40.518,17.4032558,LCC, Lecce, Lecce, Italy,40.239,18.1332559,PSR, Pescara, Pescara, Italy,42.432,14.1812560,BDS, Casale, Brindisi, Italy,40.658,17.9472561,SUF, Lamezia Terme, Lamezia, Italy,38.905,16.2422562,CTA, Catania Fontanarossa, Catania, Italy,37.467,15.0662563,LMP, Lampedusa, Lampedusa, Italy,35.498,12.6182564,PNL, Pantelleria, Pantelleria, Italy,36.817,11.9692565,PMO, Palermo, Palermo, Italy,38.176,13.0912566,REG, Reggio Calabria, Reggio Calabria, Italy,38.071,15.6522567,TPS, Trapani Birgi, Trapani, Italy,37.911,12.4882568,NSY, Sigonella, Sigonella, Italy,37.402,14.9222569,AHO, Alghero, Alghero, Italy,40.632,8.2912570,DCI, Decimomannu, Decimomannu, Italy,39.354,8.9722571,CAG, Elmas, Cagliari, Italy,39.251,9.0542572,OLB, Olbia Costa Smeralda, Olbia, Italy,40.899,9.5182573,FNU, Fenosu, Oristano, Italy,39.895,8.6382574,TTB, Tortoli, Tortoli, Italy,39.919,9.6832575,MXP, Malpensa, Milano, Italy,45.631,8.7282576,BGY, Bergamo Orio Al Serio, Bergamo, Italy,45.674,9.7042577,TRN, Torino, Torino, Italy,45.201,7.6502578,ALL, Albenga, Albenga, Italy,44.051,8.1272579,GOA, Genova Sestri, Genoa, Italy,44.413,8.8382580,LIN, Linate, Milan, Italy,45.445,9.2772581,PMF, Parma, Parma, Italy,44.824,10.2962582,QPZ, Piacenza, Piacenza, Italy,44.913,9.7232583,AOT, Aosta Airport, Aosta, Italy,45.738,7.3692584,CUF, Levaldigi, Cuneo, Italy,44.547,7.6232585,LND, Lindau HBF, Lindau, Germany,47.549,9.6882586,AVB, Aviano Ab, Aviano, Italy,46.032,12.5962587,BZO, Bolzano, Bolzano, Italy,46.460,11.3262588,BLQ, Bologna, Bologna, Italy,44.535,11.2892589,TSF, Treviso, Treviso, Italy,45.648,12.1942590,FRL, Forli, Forli, Italy,44.195,12.0702591,VBS, Montichiari, Brescia, Italy,45.429,10.3312592,TRS, Ronchi Dei Legionari, Ronchi De Legionari, Italy,45.828,13.4722593,RMI, Rimini, Rimini, Italy,44.020,12.6122594,VIC, Vicenza, Vicenza, Italy,45.573,11.5302595,QPA, Padova, Padova, Italy,45.396,11.8482596,VRN, Villafranca, Villafranca, Italy,45.396,10.8892597,AOI, Falconara, Ancona, Italy,43.616,13.3622598,VCE, Venezia Tessera, Venice, Italy,45.505,12.3522599,SAY, Ampugnano, Siena, Italy,43.256,11.2552600,CIA, Ciampino, Rome, Italy,41.799,12.5952601,FCO, Fiumicino, Rome, Italy,41.804,12.2512602,QSR, Salerno Pontecagnano Airport, Salerno, Italy,40.620,14.9112603,EBA, Marina Di Campo, Marina Di Campo, Italy,42.760,10.2392604,QLT, Latina, Latina, Italy,41.542,12.9092605,NAP, Capodichino, Naples, Italy,40.886,14.2912606,PSA, Pisa, Pisa, Italy,43.684,10.3932607,FLR, Firenze, Florence, Italy,43.810,11.2052608,GRS, Grosseto, Grosseto, Italy,42.760,11.0722609,PEG, Perugia, Perugia, Italy,43.096,12.5132610,LJU, Ljubljana, Ljubljana, Slovenia,46.224,14.4582611,MBX, Maribor, Maribor, Slovenia,46.480,15.6862612,POW, Portoroz, Portoroz, Slovenia,45.473,13.6152613,KLV, Karlovy Vary, Karlovy Vary, Czech Republic,50.203,12.9152614,OSR, Mosnov, Ostrava, Czech Republic,49.696,18.1112615,PED, Pardubice, Pardubice, Czech Republic,50.013,15.7392616,PRV, Prerov, Prerov, Czech Republic,49.426,17.4052617,PRG, Ruzyne, Prague, Czech Republic,50.101,14.2602618,LKS, Sazena, Sazena, Czech Republic,50.193,14.1532619,BRQ, Turany, Brno, Czech Republic,49.151,16.6942620,TLV, Ben Gurion, Tel-aviv, Israel,32.011,34.8872621,BEV, Teyman, Beer-sheba, Israel,31.287,34.7232622,ETH, Eilat, Elat, Israel,29.561,34.9602623,HFA, Haifa, Haifa, Israel,32.809,35.0432624,RPN, Mahanaim I Ben Yaakov, Rosh Pina, Israel,32.981,35.5722625,VDA, Ovda, Ovda, Israel,29.940,34.9362626,SDV, Sde Dov, Tel-aviv, Israel,32.115,34.7822627,MLA, Luqa, Malta, Malta,35.857,14.4782628,HOJ, Hohenems, Hohenems, Austria,47.385,9.7002629,GRZ, Graz, Graz, Austria,46.991,15.4402630,INN, Innsbruck, Innsbruck, Austria,47.260,11.3442631,KLU, Woerthersee International Airport, Klagenfurt, Austria,46.643,14.3382632,LNZ, Linz, Linz, Austria,48.233,14.1882633,SZG, Salzburg, Salzburg, Austria,47.793,13.0042634,VIE, Schwechat, Vienna, Austria,48.110,16.5702635,SMA, Santa Maria, Santa Maria (island), Portugal,36.971,-25.1712636,BGC, Braganca, Braganca, Portugal,41.858,-6.7072637,CVU, Corvo Airport, Corvo, Portugal,39.672,-31.1142638,FLW, Flores, Flores, Portugal,39.455,-31.1312639,FAO, Faro, Faro, Portugal,37.014,-7.9662640,GRW, Graciosa, Graciosa Island, Portugal,39.092,-28.0302641,HOR, Horta, Horta, Portugal,38.520,-28.7162642,TER, Lajes, Lajes (terceira Island), Portugal,38.762,-27.0912643,FNC, Madeira, Funchal, Portugal,32.698,-16.7742644,PDL, Ponta Delgada, Ponta Delgada, Portugal,37.741,-25.6982645,PIX, Pico, Pico, Portugal,38.554,-28.4412646,OPO, Porto, Porto, Portugal,41.248,-8.6812647,PXO, Porto Santo, Porto Santo, Portugal,33.073,-16.3502648,LIS, Lisboa, Lisbon, Portugal,38.781,-9.1362649,SJZ, Sao Jorge, Sao Jorge Island, Portugal,38.666,-28.1762650,VRL, Vila Real, Vila Real, Portugal,41.274,-7.7202651,BNX, Banja Luka International Airport, Banja Luka, Bosnia and Herzegovina,44.941,17.2982652,OMO, Mostar, Mostar, Bosnia and Herzegovina,43.283,17.8462653,SJJ, Sarajevo, Sarajevo, Bosnia and Herzegovina,43.825,18.3312654,ARW, Arad, Arad, Romania,46.177,21.2622655,BCM, Bacau, Bacau, Romania,46.522,26.9102656,BAY, Tautii Magheraus, Baia Mare, Romania,47.658,23.4702657,BBU, Aurel Vlaicu, Bucharest, Romania,44.503,26.1022658,CND, Mihail Kogalniceanu, Constanta, Romania,44.362,28.4882659,CLJ, Cluj Napoca, Cluj-napoca, Romania,46.785,23.6862660,CSB, Caransebes, Caransebes, Romania,45.420,22.2532661,CRA, Craiova, Craiova, Romania,44.318,23.8892662,IAS, Iasi, Iasi, Romania,47.178,27.6212663,OMR, Oradea, Oradea, Romania,47.025,21.9032664,OTP, Henri Coanda, Bucharest, Romania,44.572,26.1022665,SBZ, Sibiu, Sibiu, Romania,45.786,24.0912666,SUJ, Satu Mare, Satu Mare, Romania,47.703,22.8862667,SCV, Stefan Cel Mare, Suceava, Romania,47.688,26.3542668,CIO, Aeroclub Cioca, Timisoara, Romania,45.471,21.1122669,TCE, Cataloi, Tulcea, Romania,45.062,28.7142670,TGM, Transilvania Targu Mures, Tirgu Mures, Romania,46.468,24.4132671,TSR, Traian Vuia, Timisoara, Romania,45.810,21.3382672,GVA, Geneve Cointrin, Geneva, Switzerland,46.238,6.1092673,QNC, Neuchatel Airport, Neuchatel, Switzerland,46.958,6.8652674,SIR, Sion, Sion, Switzerland,46.220,7.3272675,ZIN, Air Base, Interlaken, Switzerland,46.677,7.8792676,LUG, Lugano, Lugano, Switzerland,46.004,8.9112677,BRN, Bern Belp, Bern, Switzerland,46.914,7.4972678,BXO, Buochs Airport, Buochs, Switzerland,46.973,8.3992679,ZRH, Zurich, Zurich, Switzerland,47.465,8.5492680,ZJI, Locarno Airport, Locarno, Switzerland,46.161,8.8792681,ACH, St Gallen Altenrhein, Altenrhein, Switzerland,47.485,9.5612682,SMV, Samedan, Samedan, Switzerland,46.534,9.8842683,ESB, Esenboga, Ankara, Turkey,40.128,32.9952684,ANK, Etimesgut, Ankara, Turkey,39.950,32.6892685,ADA, Adana, Adana, Turkey,36.982,35.2802686,AFY, Afyon, Afyon, Turkey,38.726,30.6012687,AYT, Antalya, Antalya, Turkey,36.899,30.8002688,GZT, Oguzeli, Gaziantep, Turkey,36.947,37.4792689,KYA, Konya, Konya, Turkey,37.979,32.5622690,MZH, Merzifon, Merzifon, Turkey,40.829,35.5222691,VAS, Sivas, Sivas, Turkey,39.814,36.9032692,ONQ, Zonguldak, Zonguldak, Turkey,41.506,32.0892693,MLX, Erhac, Malatya, Turkey,38.435,38.0912694,ASR, Erkilet, Kayseri, Turkey,38.770,35.4952695,DNZ, Cardak, Denizli, Turkey,37.786,29.7012696,NAV, Kapadokya, Nevsehir, Turkey,38.772,34.5352697,IST, Ataturk, Istanbul, Turkey,40.977,28.8152698,BZI, Balikesir, Balikesir, Turkey,39.619,27.9262699,BDM, Bandirma, Bandirma, Turkey,40.318,27.9782700,CKZ, Canakkale Airport, Canakkale, Turkey,40.138,26.4272701,ESK, Eskisehir, Eskisehir, Turkey,39.784,30.5822702,ADB, Adnan Menderes, Izmir, Turkey,38.292,27.1572703,IGL, Cigli, Izmir, Turkey,38.513,27.0102704,USQ, Usak Airport, Usak, Turkey,38.681,29.4722705,YEI, Yenisehir Airport, Yenisehir, Turkey,40.255,29.5632706,DLM, Dalaman, Dalaman, Turkey,36.713,28.7932707,TEQ, Tekirda_ orlu Airport, orlu, Turkey,41.138,27.9192708,BXN, Imsik, Bodrum, Turkey,37.140,27.6702709,AOE, Anadolu Airport, Eskissehir, Turkey,39.810,30.5192710,KZR, Zafer, Kutahya, Turkey,39.111,30.1302711,EZS, Elazig, Elazig, Turkey,38.607,39.2912712,DIY, Diyarbakir, Diyabakir, Turkey,37.894,40.2012713,ERC, Erzincan, Erzincan, Turkey,39.710,39.5272714,ERZ, Erzurum, Erzurum, Turkey,39.957,41.1702715,KSY, Kars Airport, Kars, Turkey,40.562,43.1152716,TZX, Trabzon, Trabzon, Turkey,40.995,39.7902717,SFQ, Sanliurfa Airport, Sanliurfa, Turkey,37.094,38.8472718,VAN, Van, Van, Turkey,38.468,43.3322719,BAL, Batman, Batman, Turkey,37.929,41.1172720,MSR, Mus Airport, Mus, Turkey,38.748,41.6612721,SIC, Sinop Airport, Sinop, Turkey,42.016,35.0662722,KCM, Kahramanmaras Airport, Kahramanmaras, Turkey,37.539,36.9532723,AJI, Agri Airport, Agri, Turkey,39.655,43.0272724,ADF, Adiyaman Airport, Adiyaman, Turkey,37.731,38.4692725,MQM, Mardin Airport, Mardin, Turkey,37.223,40.6322726,GNY, Sanliurfa GAP, Sanliurfa, Turkey,37.450,38.9002727,IGD, Igdir, Igdir, Turkey,39.983,43.8662728,HTY, Hatay Airport, Hatay, Turkey,36.363,36.2822729,ISE, Isparta Sleyman Demirel Airport, Isparta, Turkey,37.855,30.3682730,EDO, Balikesir Korfez Airport, Balikesir Korfez, Turkey,39.555,27.0142731,BJV, Bodrum - Milas, Bodrum, Turkey,37.249,27.6672732,GZP, Gazipasa Airport, Alanya, Turkey,36.299,32.3012733,SZF, Samsun-ar_amba Airport, Samsun, Turkey,41.255,36.5672734,SAW, Sabiha Gokcen, Istanbul, Turkey,40.899,29.3092735,KIV, Chisinau Intl, Chisinau, Moldova,46.928,28.9312736,GZA, Yasser Arafat Intl, Gaza, Palestine,31.246,34.2762737,OHD, Ohrid, Ohrid, Macedonia,41.180,20.7422738,SKP, Skopje, Skopje, Macedonia,41.962,21.6212739,GIB, Gibraltar, Gibraltar, Gibraltar,36.151,-5.3502740,BEG, Beograd, Belgrade, Serbia,44.818,20.3092741,INI, Nis, Nis, Serbia,43.337,21.8542742,TGD, Podgorica, Podgorica, Montenegro,42.359,19.2522743,PRN, Pristina, Pristina, Serbia,42.573,21.0362744,TIV, Tivat, Tivat, Montenegro,42.405,18.7232745,BTS, M R Stefanik, Bratislava, Slovakia,48.170,17.2132746,KSC, Kosice, Kosice, Slovakia,48.663,21.2412747,PZY, Piestany, Piestany, Slovakia,48.625,17.8282748,SLD, Sliac, Sliac, Slovakia,48.638,19.1342749,TAT, Tatry, Poprad, Slovakia,49.074,20.2412750,ILZ, _ilina Airport, _ilina, Slovakia,49.232,18.6142751,OAL, Marktoberdorf BF, Marktoberdorf, Germany,47.780,10.6272752,MOS, Marktoberdorf Schule, Marktoberdorf, Germany,47.777,10.6232753,GDT, JAGS McCartney International Airport, Cockburn Town, Turks and Caicos Islands,21.445,-71.1422754,MDS, Middle Caicos Airport, Middle Caicos, Turks and Caicos Islands,21.833,-71.8172755,NCA, North Caicos, North Caicos, Turks and Caicos Islands,21.917,-71.9402756,PLS, Providenciales, Providenciales, Turks and Caicos Islands,21.774,-72.2662757,XSC, South Caicos, South Caicos, Turks and Caicos Islands,21.516,-71.5292758,SLX, Salt Cay Airport, Salt Cay, Turks and Caicos Islands,21.333,-71.2002759,EPS, Arroyo Barril Intl, Samana, Dominican Republic,19.199,-69.4302760,BRX, Maria Montez Intl, Barahona, Dominican Republic,18.251,-71.1202761,AZS, Saman El Catey International Airport, Samana, Dominican Republic,19.267,-69.7422762,COZ, Constanza Airport, Constanza, Dominican Republic,18.908,-70.7202763,HEX, Herrera International Airport, Santo Domingo, Dominican Republic,18.475,-69.9752764,JBQ, Dr Joaquin Balaguer International Airport, La Isabela, Dominican Republic,18.573,-69.9862765,LRM, Casa De Campo Intl, La Romana, Dominican Republic,18.451,-68.9122766,PUJ, Punta Cana Intl, Punta Cana, Dominican Republic,18.567,-68.3632767,POP, Gregorio Luperon Intl, Puerto Plata, Dominican Republic,19.758,-70.5702768,SDQ, Las Americas Intl, Santo Domingo, Dominican Republic,18.430,-69.6692769,STI, Cibao Intl, Santiago, Dominican Republic,19.406,-70.6052770,CBV, Coban, Coban, Guatemala,15.469,-90.4072771,GUA, La Aurora, Guatemala City, Guatemala,14.583,-90.5272772,PBR, Puerto Barrios Airport, Puerto Barrios, Guatemala,15.731,-88.5842773,AAZ, Quezaltenango Airport, Quezaltenango, Guatemala,14.866,-91.5022774,FRS, Mundo Maya International, Flores, Guatemala,16.914,-89.8662775,AHS, Ahuas Airport, Ahuas, Honduras,15.472,-84.3522776,BHG, Brus Laguna Airport, Brus Laguna, Honduras,15.763,-84.5442777,LCE, Goloson Intl, La Ceiba, Honduras,15.742,-86.8532778,SAP, La Mesa Intl, San Pedro Sula, Honduras,15.453,-87.9242779,GJA, Guanaja, Guanaja, Honduras,16.445,-85.9072780,PEU, Puerto Lempira Airport, Puerto Lempira, Honduras,15.262,-83.7812781,RTB, Juan Manuel Galvez Intl, Roatan, Honduras,16.317,-86.5232782,TEA, Tela, Tela, Honduras,15.776,-87.4762783,TGU, Toncontin Intl, Tegucigalpa, Honduras,14.061,-87.2172784,UII, Utila Airport, Utila, Honduras,16.092,-86.8882785,OCJ, Boscobel, Ocho Rios, Jamaica,18.404,-76.9692786,KIN, Norman Manley Intl, Kingston, Jamaica,17.936,-76.7882787,MBJ, Sangster Intl, Montego Bay, Jamaica,18.504,-77.9132788,POT, Ken Jones, Port Antonio, Jamaica,18.199,-76.5352789,NEG, Negril Aerodrome, Negril, Jamaica,18.340,-78.3362790,KTP, Tinson Pen, Kingston, Jamaica,17.989,-76.8242791,MIJ, Mili Island Airport, Mili Island, Marshall Islands,6.083,171.7332792,SCX, Salina Cruz Naval Air Station, Salina Cruz, Mexico,16.213,-95.2022793,ACA, General Juan N Alvarez Intl, Acapulco, Mexico,16.757,-99.7542794,NTR, Del Norte Intl, Monterrey, Mexico,25.866,-100.2372795,AGU, Jesus Teran Intl, Aguascalientes, Mexico,21.706,-102.3182796,HUX, Bahias De Huatulco Intl, Huatulco, Mexico,15.775,-96.2632797,CVJ, General Mariano Matamoros, Cuernavaca, Mexico,18.835,-99.2612798,CME, Ciudad Del Carmen Intl, Ciudad Del Carmen, Mexico,18.654,-91.7992799,CUL, Culiacan Intl, Culiacan, Mexico,24.765,-107.4752800,CTM, Chetumal Intl, Chetumal, Mexico,18.505,-88.3272801,CEN, Ciudad Obregon Intl, Ciudad Obregon, Mexico,27.393,-109.8332802,CPE, Ingeniero Alberto Acuna Ongay Intl, Campeche, Mexico,19.817,-90.5002803,CJS, Abraham Gonzalez Intl, Ciudad Juarez, Mexico,31.636,-106.4292804,CUU, General R Fierro Villalobos Intl, Chihuahua, Mexico,28.703,-105.9652805,CVM, General Pedro Jose Mendez Intl, Ciudad Victoria, Mexico,23.703,-98.9562806,CYW, Captain Rogelio Castillo National Airport, Celaya, Mexico,20.546,-100.8872807,CZM, Cozumel Intl, Cozumel, Mexico,20.522,-86.9262808,CUA, Ciudad Constitucin Airport, Ciudad Constitucin, Mexico,25.054,-111.6152809,DGO, Durango Intl, Durango, Mexico,24.124,-104.5282810,TPQ, Tepic, Tepic, Mexico,21.419,-104.8432811,ESE, Ensenada, Ensenada, Mexico,31.795,-116.6032812,GDL, Don Miguel Hidalgo Y Costilla Intl, Guadalajara, Mexico,20.522,-103.3112813,GYM, General Jose Maria Yanez Intl, Guaymas, Mexico,27.969,-110.9252814,GUB, Guerrero Negro Airport, Guerrero Negro, Mexico,28.026,-114.0242815,TCN, Tehuacan, Tehuacan, Mexico,18.497,-97.4202816,HMO, General Ignacio P Garcia Intl, Hermosillo, Mexico,29.096,-111.0482817,CLQ, Colima, Colima, Mexico,19.277,-103.5772818,ISJ, Isla Mujeres, Isla Mujeres, Mexico,21.245,-86.7402819,SLW, Plan De Guadalupe Intl, Saltillo, Mexico,25.549,-100.9292820,JAL, Lencero Airport, Jalapa, Mexico,19.475,-96.7982821,LZC, Lazaro Cardenas, Lazard Cardenas, Mexico,18.002,-102.2212822,LMM, Valle Del Fuerte Intl, Los Mochis, Mexico,25.685,-109.0812823,BJX, Guanajuato Intl, Del Bajio, Mexico,20.993,-101.4812824,LAP, General Manuel Marquez De Leon Intl, La Paz, Mexico,24.073,-110.3622825,LTO, Loreto Intl, Loreto, Mexico,25.989,-111.3482826,MAM, General Servando Canales Intl, Matamoros, Mexico,25.770,-97.5252827,MID, Licenciado Manuel Crescencio Rejon Int, Merida, Mexico,20.937,-89.6582828,MXL, General Rodolfo Sanchez Taboada Intl, Mexicali, Mexico,32.631,-115.2422829,MLM, General Francisco J Mujica Intl, Morelia, Mexico,19.850,-101.0262830,MTT, Minatitlan, Minatitlan, Mexico,18.103,-94.5812831,LOV, Monclova Intl, Monclova, Mexico,26.956,-101.4702832,MEX, Licenciado Benito Juarez Intl, Mexico City, Mexico,19.436,-99.0722833,MTY, General Mariano Escobedo Intl, Monterrey, Mexico,25.778,-100.1072834,MZT, General Rafael Buelna Intl, Mazatlan, Mexico,23.161,-106.2662835,NOG, Nogales Intl, Nogales, Mexico,31.226,-110.9762836,NLD, Quetzalcoatl Intl, Nuevo Laredo, Mexico,27.444,-99.5702837,OAX, Xoxocotlan Intl, Oaxaca, Mexico,17.000,-96.7272838,PAZ, Tajin, Poza Rico, Mexico,20.603,-97.4612839,PBC, Hermanos Serdan Intl, Puebla, Mexico,19.158,-98.3712840,PCA, Ingeniero Juan Guillermo Villasana, Pachuca, Mexico,20.077,-98.7832841,PPE, Puerto Penasco, Punta Penasco, Mexico,31.352,-113.5262842,PDS, Piedras Negras Intl, Piedras Negras, Mexico,28.627,-100.5352843,UPN, Licenciado Y Gen Ignacio Lopez Rayon, Uruapan, Mexico,19.397,-102.0392844,PVR, Licenciado Gustavo Diaz Ordaz Intl, Puerto Vallarta, Mexico,20.680,-105.2542845,PXM, Puerto Escondido Intl, Puerto Escondido, Mexico,15.877,-97.0892846,QRO, Queretaro Intercontinental, Queretaro, Mexico,20.617,-100.1862847,REX, General Lucio Blanco Intl, Reynosa, Mexico,26.009,-98.2292848,SJD, Los Cabos Intl, San Jose Del Cabo, Mexico,23.152,-109.7212849,SLP, Ponciano Arriaga Intl, San Luis Potosi, Mexico,22.254,-100.9312850,TXA, Tlaxcala, Tlaxcala, Mexico,19.538,-98.1732851,TRC, Torreon Intl, Torreon, Mexico,25.568,-103.4112852,TGZ, Angel Albino Corzo, Tuxtla Gutierrez, Mexico,16.562,-93.0262853,TIJ, General Abelardo L Rodriguez Intl, Tijuana, Mexico,32.541,-116.9702854,TAM, General Francisco Javier Mina Intl, Tampico, Mexico,22.296,-97.8662855,TSL, Tamuin, Tamuin, Mexico,22.038,-98.8072856,TLC, Licenciado Adolfo Lopez Mateos Intl, Toluca, Mexico,19.337,-99.5662857,TAP, Tapachula Intl, Tapachula, Mexico,14.794,-92.3702858,CUN, Cancun Intl, Cancun, Mexico,21.037,-86.8772859,VSA, C P A Carlos Rovirosa Intl, Villahermosa, Mexico,17.997,-92.8172860,VER, General Heriberto Jara Intl, Vera Cruz, Mexico,19.146,-96.1872861,ZCL, General Leobardo C Ruiz Intl, Zacatecas, Mexico,22.897,-102.6872862,ZIH, Ixtapa Zihuatanejo Intl, Zihuatanejo, Mexico,17.602,-101.4612863,ZMM, Zamora, Zamora, Mexico,20.045,-102.2762864,ZLO, Playa De Oro Intl, Manzanillo, Mexico,19.145,-104.5592865,BEF, Bluefields, Bluefields, Nicaragua,11.991,-83.7742866,BZA, Bonanza Airport, Bonanza, Nicaragua,14.042,-84.6312867,RNI, Corn Island Airport, Corn Island, Nicaragua,12.169,-83.0682868,MGA, Managua Intl, Managua, Nicaragua,12.141,-86.1682869,PUZ, Puerto Cabezas, Puerto Cabezas, Nicaragua,14.047,-83.3872870,RFS, Rosita Airport, Rosita, Nicaragua,13.897,-84.4052871,SIU, Siuna Airport, Siuna, Nicaragua,13.717,-84.7772872,WSP, Waspam Airport, Waspam, Nicaragua,14.738,-83.9762873,BOC, Bocas Del Toro Intl, Bocas Del Toro, Panama,9.341,-82.2512874,CTD, Alonso Valderrama Airport, Chitr, Panama,7.988,-80.4102875,CHX, Cap Manuel Nino Intl, Changuinola, Panama,9.459,-82.5172876,DAV, Enrique Malek Intl, David, Panama,8.391,-82.4352877,ONX, Enrique Adolfo Jimenez Airport, Coln, Panama,9.357,-79.8672878,HOW, Howard, Howard, Panama,8.915,-79.6002879,JQE, Jaqu Airport, Jaqu, Panama,7.518,-78.1572880,PLP, Captain Ramon Xatruch Airport, La Palma, Panama,8.407,-78.1422881,PAC, Marcos A Gelabert Intl, Panama, Panama,8.973,-79.5562882,PUE, Puerto Obaldia, Puerto Obaldia, Panama,8.683,-77.5332883,PTY, Tocumen Intl, Panama City, Panama,9.071,-79.3832884,FON, Arenal Airport, La Fortuna/San Carlos, Costa Rica,10.478,-84.6352885,TTQ, Aerotortuguero Airport, Roxana, Costa Rica,10.569,-83.5152886,BCL, Barra del Colorado Airport, Pococi, Costa Rica,10.769,-83.5862887,CSC, Codela Airport, Guapiles, Costa Rica,10.414,-85.0922888,OTR, Coto 47, Coto 47, Costa Rica,8.602,-82.9692889,RIK, Carrillo Airport, Carrillo, Costa Rica,9.867,-85.4832890,TNO, Cabo Velas Airport, Nicoya, Costa Rica,10.356,-85.8532891,DRK, Drake Bay Airport, Puntarenas, Costa Rica,8.719,-83.6422892,GLF, Golfito, Golfito, Costa Rica,8.654,-83.1812893,PBP, Islita Airport, Nandayure, Costa Rica,9.856,-85.3712894,LIR, Daniel Oduber Quiros Intl, Liberia, Costa Rica,10.593,-85.5442895,LIO, Limon Intl, Limon, Costa Rica,9.958,-83.0222896,NOB, Nosara, Nosara Beach, Costa Rica,9.976,-85.6532897,SJO, Juan Santamaria Intl, San Jose, Costa Rica,9.994,-84.2092898,PJM, Puerto Jimenez Airport, Puerto Jimenez, Costa Rica,8.533,-83.3002899,PMZ, Palmar Sur, Palmar Sur, Costa Rica,8.951,-83.4692900,SYQ, Tobias Bolanos International Airport, San Jose, Costa Rica,9.957,-84.1402901,XQP, La Managua, Quepos, Costa Rica,9.443,-84.1302902,PLD, Playa Samara Airport, Playa Samara, Costa Rica,10.250,-85.4172903,TMU, Tambor Airport, Nicoya, Costa Rica,9.739,-85.0142904,SAL, El Salvador Intl, San Salvador, El Salvador,13.441,-89.0562905,CAP, Cap Haitien Intl, Cap Haitien, Haiti,19.733,-72.1952906,JEE, Jeremie Airport, Jeremie, Haiti,18.663,-74.1702907,PAP, Toussaint Louverture Intl, Port-au-prince, Haiti,18.580,-72.2932908,PAX, Port-de-Paix Airport, Port-de-Paix, Haiti,19.934,-72.8492909,BCA, Gustavo Rizo, Baracoa Playa, Cuba,20.365,-74.5062910,BYM, Carlos Manuel De Cespedes, Bayamo, Cuba,20.396,-76.6212911,AVI, Maximo Gomez, Ciego De Avila, Cuba,22.027,-78.7902912,CFG, Jaime Gonzalez, Cienfuegos, Cuba,22.150,-80.4142913,CYO, Vilo Acuna Intl, Cayo Largo del Sur, Cuba,21.616,-81.5462914,CMW, Ignacio Agramonte Intl, Camaguey, Cuba,21.420,-77.8472915,SCU, Antonio Maceo Intl, Santiago De Cuba, Cuba,19.970,-75.835