id,code,name,city,country,latitude,longitude3754,BFH, Bacacheri, Curitiba, Brazil,-25.405,-49.2323755,BJP, Aeroporto Estadual Arthur Siqueira, Braganca Paulista, Brazil,-22.979,-46.5383756,BSB, Presidente Juscelino Kubitschek, Brasilia, Brazil,-15.871,-47.9193757,BAU, Bauru, Bauru, Brazil,-22.345,-49.0543758,BVB, Boa Vista, Boa Vista, Brazil,2.846,-60.6903759,CAC, Cascavel, Cascavel, Brazil,-25.000,-53.5013760,CFB, Cabo Frio International Airport, Cabo Frio, Brazil,-22.922,-42.0743761,CFC, Carlos Alberto da Costa Neves Airport, Cacador, Brazil,-26.788,-50.9403762,CNF, Tancredo Neves Intl, Belo Horizonte, Brazil,-19.634,-43.9693763,CGR, Campo Grande, Campo Grande, Brazil,-20.469,-54.6733764,XAP, Chapeco, Chapeco, Brazil,-27.134,-52.6573765,CLN, Carolina, Carolina, Brazil,-7.320,-47.4593766,CKS, Carajas Airport, Parauapebas, Brazil,-6.118,-50.0043767,CCM, Forquilhinha, Criciuma, Brazil,-28.726,-49.4253768,CLV, Caldas Novas, Caldas Novas, Brazil,-17.727,-48.6113769,CAW, Bartolomeu Lisandro, Campos, Brazil,-21.698,-41.3023770,CMG, Corumba Intl, Corumba, Brazil,-19.012,-57.6733771,CWB, Afonso Pena, Curitiba, Brazil,-25.528,-49.1763772,CRQ, Caravelas, Caravelas, Brazil,-17.652,-39.2533773,CXJ, Campo Dos Bugres, Caxias Do Sul, Brazil,-29.197,-51.1883774,CGB, Marechal Rondon, Cuiaba, Brazil,-15.653,-56.1173775,CZS, Cruzeiro do Sul, Cruzeiro do Sul, Brazil,-7.600,-72.7693776,PPB, Presidente Prudente, President Prudente, Brazil,-22.175,-51.4253777,MAO, Eduardo Gomes Intl, Manaus, Brazil,-3.039,-60.0503778,IGU, Cataratas Intl, Foz Do Iguacu, Brazil,-25.596,-54.4873779,FLN, Hercilio Luz, Florianopolis, Brazil,-27.670,-48.5473780,FEN, Fernando De Noronha, Fernando Do Noronha, Brazil,-3.855,-32.4233781,FOR, Pinto Martins Intl, Fortaleza, Brazil,-3.776,-38.5333782,GIG, Galeao Antonio Carlos Jobim, Rio De Janeiro, Brazil,-22.809,-43.2443783,GYN, Santa Genoveva, Goiania, Brazil,-16.632,-49.2213784,GRU, Guarulhos Gov Andre Franco Montouro, Sao Paulo, Brazil,-23.432,-46.4703785,GPB, Tancredo Thomaz de Faria Airport, Guarapuava, Brazil,-25.383,-51.4503786,GVR, Governador Valadares Airport, Governador Valadares, Brazil,-18.895,-41.9823787,ATM, Altamira, Altamira, Brazil,-3.254,-52.2543788,IOS, Ilheus, Ilheus, Brazil,-14.816,-39.0333789,IPN, Usiminas, Ipatinga, Brazil,-19.471,-42.4883790,IMP, Prefeito Renato Moreira, Imperatriz, Brazil,-5.531,-47.4603791,JDF, Francisco De Assis, Juiz De Fora, Brazil,-21.792,-43.3873792,JPA, Presidente Castro Pinto, Joao Pessoa, Brazil,-7.148,-34.9513793,JDO, Orlando Bezerra de Menezes Airport, Juazeiro Do Norte, Brazil,-7.219,-39.2703794,JOI, Lauro Carneiro De Loyola, Joinville, Brazil,-26.224,-48.7973795,CPV, Presidente Joao Suassuna, Campina Grande, Brazil,-7.270,-35.8963796,VCP, Viracopos, Campinas, Brazil,-23.008,-47.1343797,LEC, Chapada Diamantina Airport, Lenis, Brazil,-12.482,-41.2773798,LIP, Lins, Lins, Brazil,-21.664,-49.7313799,LDB, Londrina, Londrina, Brazil,-23.334,-51.1303800,LAZ, Bom Jesus Da Lapa, Bom Jesus Da Lapa, Brazil,-13.262,-43.4083801,MAB, Maraba, Maraba, Brazil,-5.369,-49.1383802,MQH, Minacu Airport, Minacu, Brazil,-13.527,-48.2213803,MEA, Maca Airport, Maca, Brazil,-22.343,-41.7663804,MGF, Regional De Maringa Silvio Name Junior, Maringa, Brazil,-23.476,-52.0163805,MOC, Mario Ribeiro, Montes Claros, Brazil,-16.707,-43.8193806,MII, Marlia Airport, Marlia, Brazil,-22.197,-49.9263807,MCZ, Zumbi Dos Palmares, Maceio, Brazil,-9.511,-35.7923808,MCP, Macapa, Macapa, Brazil,0.051,-51.0723809,MVF, Dix Sept Rosado Airport, Mossoro, Brazil,-5.202,-37.3643810,MNX, Manicore, Manicore, Brazil,-5.811,-61.2783811,NVT, Ministro Victor Konder Intl, Navegantes, Brazil,-26.880,-48.6513812,GEL, Santo Angelo, Santo Angelo, Brazil,-28.282,-54.1693813,NAT, Augusto Severo, Natal, Brazil,-5.911,-35.2483814,POA, Salgado Filho, Porto Alegre, Brazil,-29.994,-51.1713815,POO, Pocos De Caldas, Pocos De Caldas, Brazil,-21.843,-46.5683816,PFB, Lauro Kurtz, Passo Fundo, Brazil,-28.244,-52.3273817,PMW, Palmas, Palmas, Brazil,-10.242,-48.3533818,PET, Pelotas, Pelotas, Brazil,-31.718,-52.3283819,PNZ, Senador Nilo Coelho, Petrolina, Brazil,-9.362,-40.5693820,PNB, Porto Nacional, Porto Nacional, Brazil,-10.719,-48.4003821,PMG, Ponta Pora, Ponta Pora, Brazil,-22.550,-55.7033822,BPS, Aeroporto de Porto Seguro, Porto Seguro, Brazil,-16.439,-39.0813823,PVH, Governador Jorge Teixeira De Oliveira, Porto Velho, Brazil,-8.709,-63.9023824,VDC, Vitria da Conquista Airport, Vitria Da Conquista, Brazil,-14.863,-40.8633825,RBR, Plcido de Castro, Rio Branco, Brazil,-9.583,-67.4843826,REC, Guararapes Gilberto Freyre Intl, Recife, Brazil,-8.127,-34.9233827,RIG, Rio Grande, Rio Grande, Brazil,-32.083,-52.1673828,SDU, Santos Dumont, Rio De Janeiro, Brazil,-22.910,-43.1633829,RAO, Leite Lopes, Ribeirao Preto, Brazil,-21.134,-47.7743830,STU, Santa Cruz, Rio De Janeiro, Brazil,-22.932,-43.7193831,SJK, Professor Urbano Ernesto Stumpf, Sao Jose Dos Campos, Brazil,-23.228,-45.8633832,SLZ, Marechal Cunha Machado Intl, Sao Luis, Brazil,-2.585,-44.2343833,RIA, Santa Maria Airport, Santa Maria, Brazil,-29.711,-53.6883834,STM, Santarem, Santarem, Brazil,-2.422,-54.7933835,CGH, Congonhas, Sao Paulo, Brazil,-23.627,-46.6553836,SJP, Sao Jose Do Rio Preto, Sao Jose Do Rio Preto, Brazil,-20.817,-49.4073837,SSZ, Base Aerea De Santos, Santos, Brazil,-23.925,-46.2883838,SSA, Deputado Luis Eduardo Magalhaes, Salvador, Brazil,-12.911,-38.3313839,TMT, Trombetas, Oriximina, Brazil,-1.490,-56.3973840,UNA, Una-Comandatuba Airport, Una, Brazil,-15.355,-38.9993841,TOW, Toledo Airport, Toledo, Brazil,-24.686,-53.6983842,THE, Senador Petronio Portella, Teresina, Brazil,-5.060,-42.8233843,TFF, Tefe, Tefe, Brazil,-3.383,-64.7243844,TBT, Tabatinga, Tabatinga, Brazil,-4.256,-69.9363845,TUR, Tucurui, Tucurui, Brazil,-3.786,-49.7203846,PAV, Paulo Afonso, Paulo Alfonso, Brazil,-9.401,-38.2513847,URG, Rubem Berta, Uruguaiana, Brazil,-29.782,-57.0383848,UDI, Ten Cel Av Cesar Bombonato, Uberlandia, Brazil,-18.883,-48.2263849,UBA, Uberaba, Uberaba, Brazil,-19.765,-47.9653850,VAG, Major Brigadeiro Trompowsky, Varginha, Brazil,-21.590,-45.4733851,BVH, Vilhena, Vilhena, Brazil,-12.694,-60.0983852,VIX, Goiabeiras, Vitoria, Brazil,-20.258,-40.2863853,QPS, Campo Fontenelle, Piracununga, Brazil,-21.985,-47.3353854,ARI, Chacalluta, Arica, Chile,-18.349,-70.3393855,BBA, Balmaceda, Balmaceda, Chile,-45.916,-71.6893856,CCH, Chile Chico, Chile Chico, Chile,-46.583,-71.6873857,CJC, El Loa, Calama, Chile,-22.498,-68.9043858,PUQ, Carlos Ibanez Del Campo Intl, Punta Arenas, Chile,-53.003,-70.8553859,GXQ, Teniente Vidal, Coyhaique, Chile,-45.594,-72.1063860,IQQ, Diego Aracena Intl, Iquique, Chile,-20.535,-70.1813861,SCL, Arturo Merino Benitez Intl, Santiago, Chile,-33.393,-70.7863862,ESR, Ricardo Garca Posada Airport, El Salvador, Chile,-26.311,-69.7653863,ANF, Cerro Moreno Intl, Antofagasta, Chile,-23.444,-70.4453864,LSQ, Maria Dolores, Los Angeles, Chile,-37.402,-72.4253865,CPO, Copiapo, Copiapo, Chile,-27.000,-70.0003866,CCP, Carriel Sur Intl, Concepcion, Chile,-36.773,-73.0633867,IPC, Mataveri Intl, Easter Island, Chile,-27.165,-109.4223868,ZOS, Canal Bajo Carlos Hott Siebert, Osorno, Chile,-40.611,-73.0613869,PNT, Puerto Natales, Puerto Natales, Chile,-51.733,-72.5173870,ZPC, Pucn Airport, Pucon, Chile,-39.293,-71.9163871,LSC, La Florida, La Serena, Chile,-29.916,-71.2003872,ZCO, Maquehue, Temuco, Chile,-38.767,-72.6373873,PMC, El Tepual Intl, Puerto Montt, Chile,-41.439,-73.0943874,WCH, Chaiten, Chaiten, Chile,-42.933,-72.6993875,ZAL, Pichoy, Valdivia, Chile,-39.650,-73.0863876,CPQ, Amarais Airport, Campinas, Brazil,-22.859,-47.1083877,QCJ, Botucatu, Botucatu, Brazil,-22.938,-48.4673878,OLC, Senadora Eunice Micheles Airport, Sao Paulo de Olivenca, Brazil,-3.466,-68.9193879,SOD, Sorocaba Airport, Sorocaba, Brazil,-23.478,-47.4903880,QNV, Aeroclube de Nova Iguacu, Nova Iguacu, Brazil,-22.745,-43.4603881,OIA, Ourilandia do Norte Airport, Ourilandia do Norte, Brazil,-6.763,-51.0503882,QSC, Sao Carlos TAM, Sao Carlos, Brazil,-21.875,-47.9043883,IZA, Zona da Mata Regional Airport, Juiz de Fora, Brazil,-21.513,-43.1733884,ATF, Chachoan, Ambato, Ecuador,-1.212,-78.5753885,OCC, Francisco De Orellana, Coca, Ecuador,-0.463,-76.9873886,CUE, Mariscal Lamar, Cuenca, Ecuador,-2.889,-78.9843887,GPS, Seymour, Galapagos, Ecuador,-0.454,-90.2663888,GYE, Jose Joaquin De Olmedo Intl, Guayaquil, Ecuador,-2.157,-79.8843889,LGQ, Nueva Loja Airport, Lago Agrio, Ecuador,0.093,-76.8683890,XMS, Coronel E Carvajal, Macas, Ecuador,-2.299,-78.1213891,MCH, General Manuel Serrano, Machala, Ecuador,-3.269,-79.9623892,MEC, Eloy Alfaro Intl, Manta, Ecuador,-0.946,-80.6793893,PVO, Reales Tamarindos, Portoviejo, Ecuador,-1.042,-80.4723894,UIO, Mariscal Sucre Intl, Quito, Ecuador,-0.141,-78.4883895,SNC, General Ulpiano Paez, Salinas, Ecuador,-2.205,-80.9893896,PTZ, Shell Mera, Pastaza, Ecuador,-2.000,-77.0003897,SCY, San Cristbal Airport, San Cristbal, Ecuador,-0.910,-89.6173898,TPN, Tiputini, Tiputini, Ecuador,-0.767,-75.5333899,LOH, Camilo Ponce Enriquez Airport, La Toma (Catamayo), Ecuador,-3.996,-79.3723900,ESM, General Rivadeneira Airport, Esmeraldas, Ecuador,0.979,-79.6273901,TPC, Tarapoa, Tarapoa, Ecuador,-0.123,-76.3383902,TUA, Teniente Coronel Luis A Mantilla, Tulcan, Ecuador,0.810,-77.7083903,PSY, Stanley Airport, Stanley, Falkland Islands,-51.686,-57.7783904,ASU, Silvio Pettirossi Intl, Asuncion, Paraguay,-25.240,-57.5193905,AGT, Ciudad del Este, Ciudad del Este, Paraguay,-25.456,-54.8443906,PJC, Dr. Augusto Roberto Fuster International Airport, Pedro Juan Caballero, Paraguay,-22.641,-55.8303907,MSI, Sun Island Airport, South Aari Atoll, Maldives,3.485,72.8043908,FRC, Franca Airport, Franca, Brazil,-20.539,-47.4013909,BYO, Bonito Airport, Bointo, Brazil,-21.247,-56.4533910,CFO, Confresa Airport, Confresa, Brazil,-10.634,-51.5673911,JTC, Bauru-Arealva, Bauru, Brazil,-22.158,-49.0683912,ACR, Araracuara Airport, Araracuara, Colombia,-0.580,-72.4103913,ACD, Alcides Fernandez Airport, Acandi, Colombia,8.517,-77.3003914,AXM, El Eden, Armenia, Colombia,4.453,-75.7663915,PUU, Tres De Mayo, Puerto Asis, Colombia,0.505,-76.5013916,BGA, Palonegro, Bucaramanga, Colombia,7.127,-73.1853917,BOG, Eldorado Intl, Bogota, Colombia,4.702,-74.1473918,BAQ, Ernesto Cortissoz, Barranquilla, Colombia,10.890,-74.7813919,BSC, Jose Celestino Mutis, Bahia Solano, Colombia,6.203,-77.3953920,BUN, Gerardo Tobar Lopez, Buenaventura, Colombia,3.820,-76.9903921,CPB, Capurgana Airport, Capurgana, Colombia,8.617,-77.3333922,CUC, Camilo Daza, Cucuta, Colombia,7.928,-72.5123923,COG, Mandinga Airport, Condoto, Colombia,5.072,-76.6763924,CTG, Rafael Nunez, Cartagena, Colombia,10.442,-75.5133925,CLO, Alfonso Bonilla Aragon Intl, Cali, Colombia,3.543,-76.3823926,TCO, La Florida, Tumaco, Colombia,1.814,-78.7493927,CAQ, Juan H. White, Caucasia, Colombia,7.968,-75.1983928,CZU, Las Brujas, Corozal, Colombia,9.333,-75.2863929,EBG, El Bagre Airport, El Bagre, Colombia,7.596,-74.8093930,EJA, Yariguies, Barrancabermeja, Colombia,7.024,-73.8073931,FLA, Gustavo Artunduaga Paredes, Florencia, Colombia,1.589,-75.5643932,CRC, Santa Ana Airport, Cartago, Colombia,4.758,-75.9563933,GPI, Juan Casiano, Guapi, Colombia,2.570,-77.8993934,GLJ, La Jagua Airport, Garzn, Colombia,2.170,-75.6703935,IBE, Perales, Ibague, Colombia,4.422,-75.1333936,IPI, San Luis, Ipiales, Colombia,0.862,-77.6723937,LQM, Caucaya Airport, Puerto Leguzamo, Colombia,-0.180,-74.7703938,LPD, La Pedrera Airport, La Pedrera, Colombia,-1.330,-69.5803939,LET, Alfredo Vasquez Cobo, Leticia, Colombia,-4.194,-69.9433940,EOH, Olaya Herrera, Medellin, Colombia,6.220,-75.5913941,MGN, Baracoa, Magangue, Colombia,9.285,-74.8463942,MTR, Los Garzones, Monteria, Colombia,8.824,-75.8263943,MVP, Fabio Alberto Leon Bentley, Mitu, Colombia,1.254,-70.2343944,MZL, La Nubia, Manizales, Colombia,5.030,-75.4653945,NQU, Reyes Murillo Airport, Nuqu, Colombia,5.700,-77.2803946,NVA, Benito Salas, Neiva, Colombia,2.950,-75.2943947,OCV, Aguas Claras, Ocana, Colombia,8.315,-73.3583948,OTU, Otu, Otu, Colombia,7.010,-74.7153949,PCR, Puerto Carreno, Puerto Carreno, Colombia,6.185,-67.4933950,PDA, Obando Airport, Puerto Inrida, Colombia,3.850,-67.9103951,PEI, Matecana, Pereira, Colombia,4.813,-75.7403952,PPN, Guillermo Leon Valencia, Popayan, Colombia,2.454,-76.6093953,PSO, Antonio Narino, Pasto, Colombia,1.396,-77.2913954,PVA, El Embrujo, Providencia, Colombia,13.357,-81.3583955,MDE, Jose Maria Cordova, Rio Negro, Colombia,6.165,-75.4233956,RCH, Almirante Padilla, Rio Hacha, Colombia,11.526,-72.9263957,RVE, Los Colonizadores Airport, Saravena, Colombia,6.917,-71.9003958,SJE, Jorge E Gonzalez Torres, San Jose Del Guaviare, Colombia,2.580,-72.6393959,SMR, Simon Bolivar, Santa Marta, Colombia,11.120,-74.2313960,ADZ, Gustavo Rojas Pinilla, San Andres Island, Colombia,12.584,-81.7113961,SVI, Eduardo Falla Solano, San Vincente De Caguan, Colombia,2.152,-74.7663962,TLU, Golfo de Morrosquillo Airport, Tolu, Colombia,9.512,-75.5863963,TME, Tame, Tame, Colombia,6.451,-71.7603964,AUC, Santiago Perez, Arauca, Colombia,7.069,-70.7373965,UIB, El Carano, Quibdo, Colombia,5.691,-76.6413966,ULQ, Farfan, Tulua, Colombia,4.088,-76.2353967,VGZ, Villa Garzon Airport, Villa Garzon, Colombia,0.979,-76.6063968,VUP, Alfonso Lopez Pumarejo, Valledupar, Colombia,10.435,-73.2503969,VVC, Vanguardia, Villavicencio, Colombia,4.168,-73.6143970,EYP, El Alcaravn Airport, Yopal, Colombia,5.319,-72.3843971,BJO, Bermejo, Bermejo, Bolivia,-22.773,-64.3133972,CBB, Jorge Wilsterman, Cochabamba, Bolivia,-17.421,-66.1773973,CIJ, Heroes Del Acre, Cobija, Bolivia,-11.040,-68.7833974,GYA, Capitn de Av. Emilio Beltrn Airport, Guayaramern, Bolivia,-10.821,-65.3463975,LPB, El Alto Intl, La Paz, Bolivia,-16.513,-68.1923976,POI, Capitan Nicolas Rojas, Potosi, Bolivia,-19.543,-65.7243977,PUR, Puerto Rico Airport, Puerto Rico/Manuripi, Bolivia,-11.108,-67.5513978,PSZ, Tte De Av Salvador Ogaya G, Puerto Suarez, Bolivia,-18.975,-57.8213979,RIB, Capitn Av. Selin Zeitun Lopez Airport, Riberalta, Bolivia,-11.000,-66.0003980,RBQ, Rurrenabaque Airport, Rerrenabaque, Bolivia,-14.428,-67.4983981,REY, Reyes Airport, Reyes, Bolivia,-14.304,-67.3533982,SRJ, Capitn Av. German Quiroga G. Airport, San Borja, Bolivia,-14.859,-66.7383983,SRE, Juana Azurduy De Padilla, Sucre, Bolivia,-19.007,-65.2893984,TJA, Capitan Oriel Lea Plaza, Tarija, Bolivia,-21.556,-64.7013985,TDD, Tte Av Jorge Henrich Arauz, Trinidad, Bolivia,-14.819,-64.9183986,UYU, Uyuni Airport, Uyuni, Bolivia,-20.467,-66.8333987,VVI, Viru Viru Intl, Santa Cruz, Bolivia,-17.645,-63.1353988,BYC, Yacuiba, Yacuiba, Bolivia,-21.961,-63.6523989,ABN, Albina Airstrip, Albina, Suriname,5.517,-54.0503990,TOT, Totness Airstrip, Totness, Suriname,5.866,-56.3283991,DRJ, Drietabbetje Airstrip, Drietabbetje, Suriname,4.117,-54.6673992,PBM, Johan A Pengel Intl, Zandery, Suriname,5.453,-55.1883993,ICK, Majoor Henry Fernandes Airport, Nieuw Nickerie, Suriname,5.956,-57.0393994,OEM, Vincent Fayks Airport, Paloemeu, Suriname,5.811,-55.1913995,SMZ, Stoelmans Eiland Airstrip, Stoelmans Eiland, Suriname,4.350,-54.4173996,AGI, Wageningen Airstrip, Wageningen, Suriname,5.767,-56.6333997,ORG, Zorg en Hoop Airport, Paramaribo, Suriname,5.811,-55.1913998,BRA, Barreiras Airport, Barreiras, Brazil,-12.083,-45.0003999,RDC, Redencao Airport, Redencao, Brazil,-8.033,-49.9804000,DTI, Diamantina Airport, Diamantina, Brazil,-18.232,-43.6504001,SXX, Sao Felix do Xingu Airport, Sao Felix do Xingu, Brazil,-6.641,-51.9524002,GNM, Guanambi Airport, Guanambi, Brazil,-14.217,-42.7834003,CMP, Campo Alegre Airport, Santana do Araguaia, Brazil,-9.505,-50.6254004,MVS, Mucuri Airport, Mucuri, Brazil,-18.049,-39.8644005,ORX, Oriximina Airport, Oriximina, Brazil,-1.714,-55.8364006,POJ, Patos de Minas Airport, Patos de Minas, Brazil,-18.673,-46.4914007,CAU, Caruaru Airport, Caruaru, Brazil,-8.282,-36.0144008,SFK, Soure Airport, Soure, Brazil,-0.717,-48.5234009,VAL, Valenca Airport, Valenca, Brazil,-13.297,-38.9924010,BVS, Breves Airport, Breves, Brazil,-1.682,-50.4804011,CAY, Rochambeau, Cayenne, French Guiana,4.820,-52.3604012,MPY, Maripasoula Airport, Maripasoula, French Guiana,3.658,-54.0374013,LDX, Saint-Laurent-du-Maroni Airport, Saint-Laurent-du-Maroni, French Guiana,5.483,-54.0344014,XAU, Saul Airport, Saul, French Guiana,3.614,-53.2044015,LHC, Caballococha Airport, Caballococha, Peru,-3.917,-70.5084016,PCL, Cap Fap David Abenzur Rengifo Intl, Pucallpa, Peru,-8.378,-74.5744017,CHM, Teniente Jaime A De Montreuil Morales, Chimbote, Peru,-9.150,-78.5244018,CIX, Capt Jose A Quinones Gonzales Intl, Chiclayo, Peru,-6.787,-79.8284019,AYP, Coronel Fap Alfredo Mendivil Duarte, Ayacucho, Peru,-13.155,-74.2044020,ANS, Andahuaylas, Andahuaylas, Peru,-13.706,-73.3504021,ATA, Comandante Fap German Arias Graziani, Anta, Peru,-9.347,-77.5984022,LIM, Jorge Chavez Intl, Lima, Peru,-12.022,-77.1144023,JJI, Juanjui, Juanjui, Peru,-7.169,-76.7294024,JUL, Juliaca, Juliaca, Peru,-15.467,-70.1584025,CJA, Mayor General FAP Armando Revoredo Iglesias Airport, Cajamarca, Peru,-7.139,-78.4894026,TBP, Pedro Canga, Tumbes, Peru,-3.553,-80.3814027,YMS, Moises Benzaquen Rengifo, Yurimaguas, Peru,-5.894,-76.1184028,HUU, Alferez Fap David Figueroa Fernandini Airport, Hunuco, Peru,-9.879,-76.2054029,CHH, Chachapoyas, Chachapoyas, Peru,-6.202,-77.8564030,IQT, Coronel Francisco Secada Vignetta Intl, Iquitos, Peru,-3.785,-73.3094031,AQP, Rodriguez Ballon, Arequipa, Peru,-16.341,-71.5834032,TRU, Capitan Carlos Martinez De Pinillos, Trujillo, Peru,-8.081,-79.1094033,PIO, Pisco Intl, Pisco, Peru,-13.745,-76.2204034,TPP, Cadete Guillermo Del Castillo Paredes, Tarapoto, Peru,-6.509,-76.3734035,TCQ, Coronel Carlos Ciriani Santa Rosa Intl, Tacna, Peru,-18.053,-70.2764036,PEM, Padre Aldamiz, Puerto Maldonado, Peru,-12.614,-69.2294037,PIU, Capitan Fap Guillermo Concha Iberico, Piura, Peru,-5.206,-80.6164038,TYL, Capitan Montes, Talara, Peru,-4.577,-81.2544039,NZA, Maria Reiche Neuman Airport, Nazca, Peru,-14.854,-74.9624040,CUZ, Teniente Alejandro Velasco Astete Intl, Cuzco, Peru,-13.536,-71.9394041,BNU, Aeroporto Blumenau, BLUMENAU, Brazil,-26.834,-49.0924042,CCI, Concordia Airport, Concordia, Brazil,-27.181,-52.0534043,DOU, Dourados Airport, Dourados, Brazil,-22.221,-54.8064044,ERM, Erechim Airport, Erechim, Brazil,-27.662,-52.2684045,FBE, Paulo Abdala Airport, Francisco Beltrao, Brazil,-26.059,-53.0634046,JCB, Joacaba Airport, Joacaba, Brazil,-27.173,-51.5014047,UMU, Orlando de Carvalho Airport, Umuarama, Brazil,-23.799,-53.3144048,SRA, Santa Rosa Airport, Santa Rosa, Brazil,-27.907,-54.5204049,CYR, Laguna de Los Patos International Airport, Colonia, Uruguay,-34.456,-57.7714050,PDP, Capitan Corbeta C A Curbelo International Airport, Punta del Este, Uruguay,-34.855,-55.0944051,MVD, Carrasco Intl, Montevideo, Uruguay,-34.838,-56.0314052,MDO, El Jaguel / Punta del Este Airport, Maldonado, Uruguay,-34.917,-54.9174053,RVY, Rivera International Airport, Rivera, Uruguay,-30.974,-55.4764054,STY, Nueva Hesperides Intl, Salto, Uruguay,-31.438,-57.9854055,AGV, Oswaldo Guevara Mujica, Acarigua, Venezuela,9.553,-69.2384056,AAO, Anaco, Anaco, Venezuela,9.430,-64.4714057,BLA, General Jose Antonio Anzoategui Intl, Barcelona, Venezuela,10.107,-64.6894058,BNS, Barinas, Barinas, Venezuela,8.620,-70.2214059,BRM, Barquisimeto Intl, Barquisimeto, Venezuela,10.043,-69.3594060,MYC, Escuela Mariscal Sucre Airport, Maracay, Venezuela,10.250,-67.6494061,SVC, Grant County Airport, Silver City, United States,32.637,-108.1564062,CBL, Ciudad Bolivar, Ciudad Bolivar, Venezuela,8.122,-63.5374063,CAJ, Canaima, Canaima, Venezuela,6.232,-62.8544064,CUP, General Jose Francisco Bermudez, Carupano, Venezuela,10.660,-63.2624065,CZE, Jose Leonardo Chirinos, Coro, Venezuela,11.415,-69.6824066,CUM, Antonio Jose De Sucre, Cumana, Venezuela,10.450,-64.1304067,GUI, Guiria, Guiria, Venezuela,10.574,-62.3134068,GUQ, Guanare, Guanare, Venezuela,9.027,-69.7554069,LSP, Josefa Camejo, Paraguana, Venezuela,11.781,-70.1514070,LFR, La Fria, La Fria, Venezuela,8.239,-72.2714071,MAR, La Chinita Intl, Maracaibo, Venezuela,10.558,-71.7284072,MRD, Alberto Carnevalli, Merida, Venezuela,8.582,-71.1614073,PMV, Del Caribe Intl Gen Santiago Marino, Porlamar, Venezuela,10.913,-63.9684074,CCS, Simon Bolivar Intl, Caracas, Venezuela,10.603,-66.9914075,MUN, Maturin, Maturin, Venezuela,9.749,-63.1534076,PYH, Casique Aramare, Puerto Ayacucho, Venezuela,5.620,-67.6064077,PBL, General Bartolome Salom Intl, Puerto Cabello, Venezuela,10.481,-68.0734078,PZO, General Manuel Carlos Piar, Guayana, Venezuela,8.289,-62.7604079,LRV, Gran Roque Airport, Los Roques, Venezuela,11.950,-66.6704080,SVZ, San Antonio Del Tachira, San Antonio, Venezuela,7.841,-72.4404081,STD, Mayor Buenaventura Vivas, Santo Domingo, Venezuela,7.565,-72.0354082,SFH, Sub Teniente Nestor Arias, San Felipe, Venezuela,10.279,-68.7554083,SFD, San Fernando De Apure, San Fernando De Apure, Venezuela,7.883,-67.4444084,SOM, San Tome, San Tome, Venezuela,8.945,-64.1514085,STB, Santa Barbara Del Zulia, Santa Barbara, Venezuela,8.974,-71.9434086,TUV, Tucupita, Tucupita, Venezuela,9.089,-62.0944087,VLN, Arturo Michelena Intl, Valencia, Venezuela,10.150,-67.9284088,VIG, Juan Pablo Prez Alfonso Airport, El Viga, Venezuela,8.624,-71.6734089,VLV, Dr Antonio Nicolas Briceno, Valera, Venezuela,9.341,-70.5844090,VDP, Valle De La Pascua, Valle De La Pascua, Venezuela,9.222,-65.9944091,BAZ, Barcelos Airport, Barcelos, Brazil,-0.975,-62.9244092,RBB, Borba Airport, Borba, Brazil,-4.388,-59.5944093,CAF, Carauari Airport, Carauari, Brazil,-4.871,-66.8984094,DMT, Diamantino Airport, Diamantino, Brazil,-14.409,-56.4464095,ERN, Amaury Feitosa Tomaz Airport, Eirunepe, Brazil,-6.639,-69.8804096,LVR, Bom Futuro Airport, Lucas do Rio Verde, Brazil,-13.050,-55.9114097,SXO, Sao Felix do Araguaia Airport, Sao Felix do Araguaia, Brazil,-11.633,-50.6894098,GRP, Gurupi Airport, Gurupi, Brazil,-11.729,-49.0694099,AUX, Araguaina Airport, Araguaina, Brazil,-7.228,-48.2414100,HUW, Humaita Airport, Humaita, Brazil,-7.532,-63.0724101,JPR, Ji-Paran Airport, Ji-Paran, Brazil,-10.871,-61.8474102,CIZ, Coari Airport, Coari, Brazil,-4.085,-63.1414103,LBR, Labrea Airport, Labrea, Brazil,-7.259,-64.7984104,RVD, General leite de Castro Airport, Rio Verde, Brazil,-17.790,-50.9184105,MBZ, Maues Airport, Maues, Brazil,-3.384,-57.7194106,NVP, Novo Aripuana Airport, Novo Aripuana, Brazil,-5.121,-60.3814107,FBA, Fonte Boa Airport, Fonte Boa, Brazil,-2.533,-66.0834108,PIN, Julio Belem Airport, Parintins, Brazil,-2.628,-56.7364109,ROO, Rondonopolis Airport, Rondonopolis, Brazil,-16.467,-54.6334110,OPS, Sinop Airport, Sinop, Brazil,-11.885,-55.5864111,STZ, Confresa Airport, Santa Terezinha, Brazil,-10.470,-50.5034112,IRZ, Tapuruquara Airport, Santa Isabel do Rio Negro, Brazil,-0.417,-65.0344113,NAI, Annai Airport, Annai, Guyana,3.950,-59.1334114,GEO, Cheddi Jagan Intl, Georgetown, Guyana,6.499,-58.2544115,OGL, Ogle, Georgetown, Guyana,6.807,-58.1044116,IMB, Imbaimadai Airport, Imbaimadai, Guyana,5.693,-60.2824117,KAI, Kaieteur, Kaieteur, Guyana,5.167,-59.4834118,KAR, Kamarang Airport, Kamarang, Guyana,5.865,-60.6144119,LTM, Lethem, Lethem, Guyana,3.373,-59.7894120,USI, Mabaruma Airport, Mabaruma, Guyana,8.200,-59.7834121,MHA, Mahdia Airport, Mahdia, Guyana,5.267,-59.1504122,ORJ, Orinduik Airport, Orinduik, Guyana,4.700,-60.0174123,ANU, V C Bird Intl, Antigua, Antigua and Barbuda,17.137,-61.7934124,BBQ, Codrington Airport, Codrington, Antigua and Barbuda,17.636,-61.8294125,BGI, Grantley Adams Intl, Bridgetown, Barbados,13.075,-59.4924126,DCF, Canefield, Canefield, Dominica,15.337,-61.3924127,DOM, Melville Hall, Dominica, Dominica,15.547,-61.3004128,DSD, La Dsirade Airport, Grande Anse, Guadeloupe,16.297,-61.0844129,BBR, Baillif Airport, Basse Terre, Guadeloupe,16.013,-61.7424130,SFC, St-Franois Airport, St-Franois, Guadeloupe,16.258,-61.2634131,FDF, Le Lamentin, Fort-de-france, Martinique,14.591,-61.0034132,SFG, Grand Case, St. Martin, Guadeloupe,18.100,-63.0474133,SBH, Saint Barthelemy, Gustavia, France,17.902,-62.8324134,GBJ, Les Bases Airport, Grand Bourg, Guadeloupe,15.869,-61.2704135,PTP, Le Raizet, Pointe-a-pitre, Guadeloupe,16.265,-61.5324136,LSS, Terre-de-Haut Airport, Les Saintes, Guadeloupe,15.864,-61.5814137,GND, Point Salines Intl, Point Salines, Grenada,12.004,-61.7864138,STT, Cyril E King, St. Thomas, Virgin Islands,18.337,-64.9734139,STX, Henry E Rohlsen, St. Croix Island, Virgin Islands,17.702,-64.7994140,ARE, Antonio Juarbe Pol Airport, Arecibo, Puerto Rico,18.451,-66.6764141,BQN, Rafael Hernandez, Aguadilla, Puerto Rico,18.495,-67.1294142,VQS, Vieques Airport, Vieques Island, Puerto Rico,18.116,-65.4234143,CPX, Culebra Airport, Culebra Island, Puerto Rico,18.313,-65.3034144,FAJ, Diego Jimenez Torres, Fajardo, Puerto Rico,18.309,-65.6624145,SIG, Fernando Luis Ribas Dominicci, San Juan, Puerto Rico,18.457,-66.0984146,MAZ, Eugenio Maria De Hostos, Mayaguez, Puerto Rico,18.256,-67.1484147,PSE, Mercedita, Ponce, Puerto Rico,18.008,-66.5634148,RVR, Jose Aponte de la Torre Airport, Ceiba, Puerto Rico,18.245,-65.6434149,SJU, Luis Munoz Marin Intl, San Juan, Puerto Rico,18.439,-66.0024150,SKB, Robert L Bradshaw, Basse Terre, Saint Kitts and Nevis,17.311,-62.7194151,NEV, Vance Winkworth Amory International Airport, Charlestown, Saint Kitts and Nevis,17.206,-62.5904152,SLU, George F L Charles, Castries, Saint Lucia,14.020,-60.9934153,UVF, Hewanorra Intl, Hewandorra, Saint Lucia,13.733,-60.9534154,AUA, Reina Beatrix Intl, Oranjestad, Aruba,12.501,-70.0154155,BON, Flamingo, Kralendijk, Netherlands Antilles,12.131,-68.269